Title,Url,Image,Avg_ratings,Num_ratings,Price
"FEYOTH (it was only a Cover, not a Full Bean Bag Giant Fur Bean Bag Chair for Adult Living Room Furniture Big Round Soft Fluffy Faux Fur BeanBag Lazy Sofa Bed CoverFaux Fur BeanBag Lazy Sofa Bed Cove",https://www.amazon.com/gp/slredirect/picassoRedirect.html/ref=pa_sp_atf_garden_sr_pg1_1?ie=UTF8&adId=A04765361OR63D0F1X2PI&url=%2FFEYOTH-Living-Furniture-BeanBag-CoverFaux%2Fdp%2FB09LYF1C4H%2Fref%3Dsr_1_1_sspa%3Fcrid%3D2THUN1PRZOBEX%26keywords%3Dfurniture%26qid%3D1654931178%26rnid%3D1063306%26s%3Dhome-garden%26sprefix%3Dfurnitu%252Caps%252C297%26sr%3D1-1-spons%26psc%3D1&qualifier=1654931178&id=960595089293015&widgetName=sp_atf,https://m.media-amazon.com/images/I/81QovLA5hPS._AC_UL320_.jpg,2.7 out of 5 stars,7,$99.00
"Leopard Adjustable Bar Stools with Armrest, Square Back Swivel Double Stitching with Back Bar Stool, Set of 2 (Black + Black Base)",https://www.amazon.com/Leopard-Adjustable-Stools-Armrest-Stitching/dp/B091SR32WM/ref=sr_1_2?crid=2THUN1PRZOBEX&keywords=furniture&qid=1654931178&rnid=1063306&s=home-garden&sprefix=furnitu%2Caps%2C297&sr=1-2,https://m.media-amazon.com/images/I/61AC-FDRb9S._AC_UL320_.jpg,4.2 out of 5 stars,829,$179.99
"Signature Design by Ashley Tallenger 31"" Upholstered Swivel Bar/Pub Height Bar Stool, Set of 2, Blue & Dark Brown",https://www.amazon.com/Signature-Design-Ashley-Tallenger-Upholstered/dp/B094JX1TQQ/ref=sr_1_3?crid=2THUN1PRZOBEX&keywords=furniture&qid=1654931178&rnid=1063306&s=home-garden&sprefix=furnitu%2Caps%2C297&sr=1-3,https://m.media-amazon.com/images/I/61gz3ZZvu-S._AC_UL320_.jpg,4.8 out of 5 stars,13,$260.00
Flash Furniture Hercules™ Series Plastic Folding Chair - Beige - 10 Pack 650LB Weight Capacity Comfortable Event Chair - Lightweight Folding Chair,https://www.amazon.com/Flash-Furniture-HERCULES-Capacity-Premium/dp/B018M7Z02U/ref=sr_1_4?crid=2THUN1PRZOBEX&keywords=furniture&qid=1654931178&rnid=1063306&s=home-garden&sprefix=furnitu%2Caps%2C297&sr=1-4,https://m.media-amazon.com/images/I/81SMd1Vqo7L._AC_UL320_.jpg,4.7 out of 5 stars,"6,810",$214.49
Chill Sack Bean Bag Chair: Giant 5' Memory Foam Furniture Bean Bag - Big Sofa with Soft Micro Fiber Cover - Charcoal,https://www.amazon.com/Chill-Sack-Bean-Bag-Chair/dp/B00P21TAIK/ref=sr_1_5?crid=2THUN1PRZOBEX&keywords=furniture&qid=1654931178&rnid=1063306&s=home-garden&sprefix=furnitu%2Caps%2C297&sr=1-5,https://m.media-amazon.com/images/I/716JGErOy8L._AC_UL320_.jpg,4.3 out of 5 stars,"15,539",$164.99
Flash Furniture Kids Gray 5 Piece Folding Table and Chair Set,https://www.amazon.com/Flash-Furniture-Piece-Folding-Table/dp/B09D4WPBD5/ref=sr_1_6?crid=2THUN1PRZOBEX&keywords=furniture&qid=1654931178&rnid=1063306&s=home-garden&sprefix=furnitu%2Caps%2C297&sr=1-6,https://m.media-amazon.com/images/I/91ubEDa5IgL._AC_UL320_.jpg,4.6 out of 5 stars,"24,662",$91.88
Flash Furniture 30'' Round Wood Cocktail Table with 30'' and 42'' Columns,https://www.amazon.com/Flash-Furniture-Round-Cocktail-Columns/dp/B00CLO7JKM/ref=sr_1_7?crid=2THUN1PRZOBEX&keywords=furniture&qid=1654931178&rnid=1063306&s=home-garden&sprefix=furnitu%2Caps%2C297&sr=1-7,https://m.media-amazon.com/images/I/51i+XFZR77L._AC_UL320_.jpg,4.6 out of 5 stars,"1,316",$138.61
"Flash Furniture Slatted Wood Folding Special Event Chair - Antique Black, Set of 4",https://www.amazon.com/Flash-Furniture-Slatted-Folding-Special/dp/B08XN3NYP7/ref=sr_1_8?crid=2THUN1PRZOBEX&keywords=furniture&qid=1654931178&rnid=1063306&s=home-garden&sprefix=furnitu%2Caps%2C297&sr=1-8,https://m.media-amazon.com/images/I/A1iyXD2BP4L._AC_UL320_.jpg,4.6 out of 5 stars,3,$229.99
"6 Packs Metal TV Safety Straps Furniture Security Straps Anchor TV Anti Tip Straps for Baby Proofing Child Protection Flat Screen TV, Cabinet, Dresser, Drawer",https://www.amazon.com/Furniture-Security-Proofing-Protection-Cabinet/dp/B09VPJ5KCJ/ref=sr_1_9?crid=2THUN1PRZOBEX&keywords=furniture&qid=1654931178&rnid=1063306&s=home-garden&sprefix=furnitu%2Caps%2C297&sr=1-9,https://m.media-amazon.com/images/I/81k+8jhZFyL._AC_UL320_.jpg,,,$18.99
"Flash Furniture Commercial Grade 23.75"" Square White Metal Indoor-Outdoor Table",https://www.amazon.com/Flash-Furniture-23-75-Square-Indoor-Outdoor/dp/B016BUR956/ref=sr_1_10?crid=2THUN1PRZOBEX&keywords=furniture&qid=1654931178&rnid=1063306&s=home-garden&sprefix=furnitu%2Caps%2C297&sr=1-10,https://m.media-amazon.com/images/I/71KT276NVqL._AC_UL320_.jpg,4.5 out of 5 stars,10,$112.99
"Hillsdale Furniture Cameron Swivel Ladder Back Bar Stool, Chestnut Brown",https://www.amazon.com/Hillsdale-Cameron-Ladder-Swivel-Stool/dp/B0065OXBK6/ref=sr_1_11?crid=2THUN1PRZOBEX&keywords=furniture&qid=1654931178&rnid=1063306&s=home-garden&sprefix=furnitu%2Caps%2C297&sr=1-11,https://m.media-amazon.com/images/I/81q4QBeB1KL._AC_UL320_.jpg,4.0 out of 5 stars,18,$166.31
"Hillsdale Furniture Dundee Swivel Counter Stool, Dark Coffee",https://www.amazon.com/Hillsdale-5026-826-Swivel-Counter-Coffee/dp/B0094O5W6U/ref=sr_1_12?crid=2THUN1PRZOBEX&keywords=furniture&qid=1654931178&rnid=1063306&s=home-garden&sprefix=furnitu%2Caps%2C297&sr=1-12,https://m.media-amazon.com/images/I/41qOSn+hk5L._AC_UL320_.jpg,4.5 out of 5 stars,150,$329.99
"SUPERJARE Adjustable Bar Stools Set of 2, Rustic Swivel Barstools with Back, Modern Counter Height Chairs for Pub Kitchen, Retro Brown",https://www.amazon.com/gp/slredirect/picassoRedirect.html/ref=pa_sp_mtf_garden_sr_pg1_1?ie=UTF8&adId=A08736771N6MQVXJDNBDH&url=%2FSUPERJARE-Adjustable-Barstool-Kitchen-Counter%2Fdp%2FB07XDYLCLD%2Fref%3Dsr_1_13_sspa%3Fcrid%3D2THUN1PRZOBEX%26keywords%3Dfurniture%26qid%3D1654931178%26rnid%3D1063306%26s%3Dhome-garden%26sprefix%3Dfurnitu%252Caps%252C297%26sr%3D1-13-spons%26psc%3D1&qualifier=1654931178&id=960595089293015&widgetName=sp_mtf,https://m.media-amazon.com/images/I/51dUKGRNGzL._AC_UL320_.jpg,4.6 out of 5 stars,212,$199.99
"Palama Gold Bar Cart for The Home, Large Mid Century Bar Cart Simply Assembled in 10 Minutes, 2-Tier Rolling Storage Cart with 2 Black Tempered Glass Shelves, Wine Cart with 2 Lockable Wheels",https://www.amazon.com/gp/slredirect/picassoRedirect.html/ref=pa_sp_mtf_garden_sr_pg1_1?ie=UTF8&adId=A09299322YA1XK8WX7JP6&url=%2FPalama-Bar-Cart-Large-Assembled%2Fdp%2FB09Q1WLFMD%2Fref%3Dsr_1_14_sspa%3Fcrid%3D2THUN1PRZOBEX%26keywords%3Dfurniture%26qid%3D1654931178%26rnid%3D1063306%26s%3Dhome-garden%26sprefix%3Dfurnitu%252Caps%252C297%26sr%3D1-14-spons%26psc%3D1&qualifier=1654931178&id=960595089293015&widgetName=sp_mtf,https://m.media-amazon.com/images/I/61sZMYl9gvL._AC_UL320_.jpg,4.0 out of 5 stars,3,$139.99
Miereirl Bar Stools Set of 2 Morden Height Counter Bar Stools with Polypropylene Back and Leather Seat，Swivel Adjustable Stool Chair for Home Kitchen Island-White,https://www.amazon.com/gp/slredirect/picassoRedirect.html/ref=pa_sp_mtf_garden_sr_pg1_1?ie=UTF8&adId=A011072113X1DJN2HB7ED&url=%2FMiereirl-Polypropylene-Seat%25EF%25BC%258CSwivel-Adjustable-Island-White%2Fdp%2FB09XDQTTW2%2Fref%3Dsr_1_15_sspa%3Fcrid%3D2THUN1PRZOBEX%26keywords%3Dfurniture%26qid%3D1654931178%26rnid%3D1063306%26s%3Dhome-garden%26sprefix%3Dfurnitu%252Caps%252C297%26sr%3D1-15-spons%26psc%3D1&qualifier=1654931178&id=960595089293015&widgetName=sp_mtf,https://m.media-amazon.com/images/I/71l2SMp8G7L._AC_UL320_.jpg,,,$109.99
"ACME Furniture 98002 Helmut Serving Cart, Golden Plated/Clear Glass",https://www.amazon.com/Acme-Furniture-98002-Helmut-Serving/dp/B00D5WJLNW/ref=sr_1_16?crid=2THUN1PRZOBEX&keywords=furniture&qid=1654931178&rnid=1063306&s=home-garden&sprefix=furnitu%2Caps%2C297&sr=1-16,https://m.media-amazon.com/images/I/81UPz1r4aPL._AC_UL320_.jpg,4.4 out of 5 stars,160,$204.61
"Ashley Furniture Valebeck UPH Swivel Stool (1/CN), White/Black",https://www.amazon.com/Ashley-Furniture-Valebeck-Swivel-Stool/dp/B09BDCVPZ9/ref=sr_1_17?crid=2THUN1PRZOBEX&keywords=furniture&qid=1654931178&rnid=1063306&s=home-garden&sprefix=furnitu%2Caps%2C297&sr=1-17,https://m.media-amazon.com/images/I/61DvSSTQWWL._AC_UL320_.jpg,,,$129.29
"Flash Furniture Commercial Grade 24"" High Purple Metal Indoor-Outdoor Counter Height Stool with Back",https://www.amazon.com/Flash-Furniture-3534-24-PUR-GG-Colorful-Restaurant/dp/B01K4D2KNC/ref=sr_1_18?crid=2THUN1PRZOBEX&keywords=furniture&qid=1654931178&rnid=1063306&s=home-garden&sprefix=furnitu%2Caps%2C297&sr=1-18,https://m.media-amazon.com/images/I/61F7oZbY6ML._AC_UL320_.jpg,3.9 out of 5 stars,17,$71.69
"Flash Furniture Ergonomic Mid-Back Mesh Drafting Chair with Black Fabric Seat, Adjustable Foot Ring and Adjustable Arms",https://www.amazon.com/Flash-Furniture-Ergonomic-Mid-Back-Adjustable/dp/B01NGYPYMG/ref=sr_1_19?crid=2THUN1PRZOBEX&keywords=furniture&qid=1654931178&rnid=1063306&s=home-garden&sprefix=furnitu%2Caps%2C297&sr=1-19,https://m.media-amazon.com/images/I/81BGPnTSehL._AC_UL320_.jpg,4.4 out of 5 stars,130,$213.41
"Roundhill Furniture Biony 36"" Round Bar Table Nail Head Trim",https://www.amazon.com/Roundhill-Furniture-PT164-Biony-Round/dp/B078SJ8714/ref=sr_1_20?crid=2THUN1PRZOBEX&keywords=furniture&qid=1654931178&rnid=1063306&s=home-garden&sprefix=furnitu%2Caps%2C297&sr=1-20,https://m.media-amazon.com/images/I/71VR1PvYijL._AC_UL320_.jpg,3.9 out of 5 stars,7,$193.20
"Sofa Sack - Plush Bean Bag Sofas with Super Soft Microsuede Cover - XL Memory Foam Stuffed Lounger Chairs For Kids, Adults, Couples - Jumbo Bean Bag Chair Furniture - Charcoal 6'",https://www.amazon.com/Sofa-Sack-Microsuede-Furniture-Charcoal/dp/B00P21YH3I/ref=sr_1_21?crid=2THUN1PRZOBEX&keywords=furniture&qid=1654931178&rnid=1063306&s=home-garden&sprefix=furnitu%2Caps%2C297&sr=1-21,https://m.media-amazon.com/images/I/71LQ4h5Ry+L._AC_UL320_.jpg,4.4 out of 5 stars,"3,070",$135.01
"Flash Furniture 23.25"" Round Aluminum Indoor-Outdoor Bar Height Table with Flip-Up Table",https://www.amazon.com/Flash-Furniture-Aluminum-Indoor-Outdoor-Folding/dp/B00ZADCROY/ref=sr_1_22?crid=2THUN1PRZOBEX&keywords=furniture&qid=1654931178&rnid=1063306&s=home-garden&sprefix=furnitu%2Caps%2C297&sr=1-22,https://m.media-amazon.com/images/I/91A9cClp-NL._AC_UL320_.jpg,4.1 out of 5 stars,"2,414",$76.34
"Crosley Furniture Everett Record Player Stand, Mahogany",https://www.amazon.com/Crosley-Furniture-Everett-Record-Player/dp/B015DG2OKY/ref=sr_1_23?crid=2THUN1PRZOBEX&keywords=furniture&qid=1654931178&rnid=1063306&s=home-garden&sprefix=furnitu%2Caps%2C297&sr=1-23,https://m.media-amazon.com/images/I/61HjaYA6q3L._AC_UL320_.jpg,4.4 out of 5 stars,"1,106",$158.88
Flash Furniture 10 Pack Kids White Resin Folding Event Party Chair with Vinyl Padded Seat,https://www.amazon.com/Flash-Furniture-White-Folding-Padded/dp/B08PHPBYFV/ref=sr_1_24?crid=2THUN1PRZOBEX&keywords=furniture&qid=1654931178&rnid=1063306&s=home-garden&sprefix=furnitu%2Caps%2C297&sr=1-24,https://m.media-amazon.com/images/I/81DFt+g+zxL._AC_UL320_.jpg,4.6 out of 5 stars,211,$285.99
"FITUEYES Corner Floor TV Stand for 55 65 Inch TV, Modern Tripod Easel TV Display Stand for LED LCD OLED Screens with Concealed Storage Wood and Iron TV Furniture Original Design Picasso Series",https://www.amazon.com/FITUEYES-Display-Concealed-Furniture-Original/dp/B092LYH4JB/ref=sr_1_25?crid=2THUN1PRZOBEX&keywords=furniture&qid=1654931178&rnid=1063306&s=home-garden&sprefix=furnitu%2Caps%2C297&sr=1-25,https://m.media-amazon.com/images/I/71VSlUJttaL._AC_UL320_.jpg,4.5 out of 5 stars,31,$169.99
"Crosley Furniture Edison Industrial Stool, Natural",https://www.amazon.com/Crosley-Furniture-Adjustable-Height-Natural/dp/B07FFLGJ68/ref=sr_1_26?crid=2THUN1PRZOBEX&keywords=furniture&qid=1654931178&rnid=1063306&s=home-garden&sprefix=furnitu%2Caps%2C297&sr=1-26,https://m.media-amazon.com/images/I/71HHuqmC5ML._AC_UL320_.jpg,4.0 out of 5 stars,87,$118.96
"Christopher Knight Home 221340_New 5 Foot Bean Bag, 5 Ft, Midnight Blue",https://www.amazon.com/Great-Deal-Furniture-221340_New-Waldo/dp/B016V7LM16/ref=sr_1_27?crid=2THUN1PRZOBEX&keywords=furniture&qid=1654931178&rnid=1063306&s=home-garden&sprefix=furnitu%2Caps%2C297&sr=1-27,https://m.media-amazon.com/images/I/516qsTTkr6L._AC_UL320_.jpg,4.2 out of 5 stars,25,$148.21
"CordaRoy's Chenille Bean Bag Chair, Convertible Chair Folds from Bean Bag to Bed, As Seen on Shark Tank, Moss - Queen Size",https://www.amazon.com/CordaRoys-Chenille-Chair-Convertible-Folds/dp/B00YB5877I/ref=sr_1_28?crid=2THUN1PRZOBEX&keywords=furniture&qid=1654931178&rnid=1063306&s=home-garden&sprefix=furnitu%2Caps%2C297&sr=1-28,https://m.media-amazon.com/images/I/71TJJWInj5L._AC_UL320_.jpg,4.3 out of 5 stars,"7,253",$349.99
"ALPHA HOME 24"" Bar Stool Counter Height Bar Stools with Footrest Pu Leather Backless Kitchen Dining Cafe Chair with Thick Cushion & Sturdy Chromed Metal Steel Frame Base for Indoor Outdoor,Black,2PC",https://www.amazon.com/gp/slredirect/picassoRedirect.html/ref=pa_sp_btf_garden_sr_pg1_1?ie=UTF8&adId=A010971024PWPILGRAACE&url=%2FALPHA-HOME-Counter-Footrest-Backless%2Fdp%2FB08F5F1T71%2Fref%3Dsr_1_29_sspa%3Fcrid%3D2THUN1PRZOBEX%26keywords%3Dfurniture%26qid%3D1654931178%26rnid%3D1063306%26s%3Dhome-garden%26sprefix%3Dfurnitu%252Caps%252C297%26sr%3D1-29-spons%26psc%3D1&qualifier=1654931178&id=960595089293015&widgetName=sp_btf,https://m.media-amazon.com/images/I/71z8EWF1XHL._AC_UL320_.jpg,4.7 out of 5 stars,783,$154.23
"SUPERJARE Adjustable Counter Height Bar Stools Set of 2, Swivel Tall Kitchen Counter Island Dining Chair with Backs, 24” Armless Modern Bar Stool Chairs fit Counter Island from 32” to 44”, Retro Brown",https://www.amazon.com/gp/slredirect/picassoRedirect.html/ref=pa_sp_btf_garden_sr_pg1_1?ie=UTF8&adId=A03052393RFY6ORZ1T9IF&url=%2FSUPERJARE-Adjustable-Barstool-Kitchen-Counter%2Fdp%2FB07H9SBJDJ%2Fref%3Dsr_1_30_sspa%3Fcrid%3D2THUN1PRZOBEX%26keywords%3Dfurniture%26qid%3D1654931178%26rnid%3D1063306%26s%3Dhome-garden%26sprefix%3Dfurnitu%252Caps%252C297%26sr%3D1-30-spons%26psc%3D1&qualifier=1654931178&id=960595089293015&widgetName=sp_btf,https://m.media-amazon.com/images/I/61TO35feF7L._AC_UL320_.jpg,4.6 out of 5 stars,"2,104",$219.99
"SUPERJARE Bar Stools Set of 2 - 360° Swivel Barstool Chairs with Back, Adjustable Height Bar Chairs, Modern Pub Kitchen Counter Height, Retro Brown, Fabric",https://www.amazon.com/gp/slredirect/picassoRedirect.html/ref=pa_sp_btf_garden_sr_pg1_1?ie=UTF8&adId=A0873889NV3ZUNPR221Q&url=%2FSUPERJARE-Stools-Barstool-Kitchen-Counter%2Fdp%2FB07H9Y7XJK%2Fref%3Dsr_1_31_sspa%3Fcrid%3D2THUN1PRZOBEX%26keywords%3Dfurniture%26qid%3D1654931178%26rnid%3D1063306%26s%3Dhome-garden%26sprefix%3Dfurnitu%252Caps%252C297%26sr%3D1-31-spons%26psc%3D1&qualifier=1654931178&id=960595089293015&widgetName=sp_btf,https://m.media-amazon.com/images/I/51es7EAro2L._AC_UL320_.jpg,4.7 out of 5 stars,874,$169.99
"SUPERJARE Bar Stools Set of 2 - 360° Swivel Barstools, Adjustable Height Bar Chairs, Rustic Counter Height Chairs for Pub Kitchen, Retro Brown",https://www.amazon.com/gp/slredirect/picassoRedirect.html/ref=pa_sp_btf_garden_sr_pg1_1?ie=UTF8&adId=A08738332N0Y5B0GC1ST6&url=%2FSUPERJARE-Adjustable-Stools-Swivel-Barstools%2Fdp%2FB07JM56HV4%2Fref%3Dsr_1_32_sspa%3Fcrid%3D2THUN1PRZOBEX%26keywords%3Dfurniture%26qid%3D1654931178%26rnid%3D1063306%26s%3Dhome-garden%26sprefix%3Dfurnitu%252Caps%252C297%26sr%3D1-32-spons%26psc%3D1&qualifier=1654931178&id=960595089293015&widgetName=sp_btf,https://m.media-amazon.com/images/I/51HIHgCV+oL._AC_UL320_.jpg,4.5 out of 5 stars,330,$129.99
"SUPERJARE Bar Stools Set of 2 - 360° Swivel Barstools with Back, Adjustable Height Bar Chairs, Modern Counter Height Chairs for Pub Kitchen, Vintage Brown, Fabric",https://www.amazon.com/gp/slredirect/picassoRedirect.html/ref=pa_sp_btf_garden_sr_pg1_1?ie=UTF8&adId=A08740771L71VQXZJDS4J&url=%2FSUPERJARE-Adjustable-Barstool-Kitchen-Counter%2Fdp%2FB07JM5BHJG%2Fref%3Dsr_1_33_sspa%3Fcrid%3D2THUN1PRZOBEX%26keywords%3Dfurniture%26qid%3D1654931178%26rnid%3D1063306%26s%3Dhome-garden%26sprefix%3Dfurnitu%252Caps%252C297%26sr%3D1-33-spons%26psc%3D1&qualifier=1654931178&id=960595089293015&widgetName=sp_btf,https://m.media-amazon.com/images/I/61B8vv--eCL._AC_UL320_.jpg,4.5 out of 5 stars,587,$209.99
"Palama Gold Bar Cart for The Home, Large Mid Century Bar Cart Simply Assembled in 10 Minutes, 2-Tier Rolling Storage Cart with 2 Walnut MDF Shelves, Wine Cart with 2 Lockable Wheels",https://www.amazon.com/gp/slredirect/picassoRedirect.html/ref=pa_sp_atf_next_garden_sr_pg2_1?ie=UTF8&adId=A09304002NV8GBQNSHYH0&url=%2FPalama-Gold-Assembled-Walnut-MDF%2Fdp%2FB09Q1WXD8Y%2Fref%3Dsr_1_25_sspa%3Fcrid%3D2THUN1PRZOBEX%26keywords%3Dfurniture%26qid%3D1654931230%26rnid%3D1063306%26s%3Dhome-garden%26sprefix%3Dfurnitu%252Caps%252C297%26sr%3D1-25-spons%26psc%3D1&qualifier=1654931230&id=4054089777504566&widgetName=sp_atf_next,https://m.media-amazon.com/images/I/71dcqamhgwL._AC_UL320_.jpg,4.0 out of 5 stars,3,$129.99
"MAISON ARTS Counter Height Swivel Bar Stools Set of 2 Adjustable Barstools with Back for Kitchen Counter Tall Bar Height Chairs Faux Leather High Stools for Kitchen Island,Support 300 LBS,Grey",https://www.amazon.com/gp/slredirect/picassoRedirect.html/ref=pa_sp_atf_next_garden_sr_pg2_1?ie=UTF8&adId=A05068721291UCKV6DODL&url=%2FMAISON-ARTS-Adjustable-Barstools-Capacity%2Fdp%2FB08F7LG9SN%2Fref%3Dsr_1_26_sspa%3Fcrid%3D2THUN1PRZOBEX%26keywords%3Dfurniture%26qid%3D1654931230%26rnid%3D1063306%26s%3Dhome-garden%26sprefix%3Dfurnitu%252Caps%252C297%26sr%3D1-26-spons%26psc%3D1&qualifier=1654931230&id=4054089777504566&widgetName=sp_atf_next,https://m.media-amazon.com/images/I/71yaDTGCT4L._AC_UL320_.jpg,4.3 out of 5 stars,459,$219.99
"ELETEC M8 Lag Bolt Kit for TV Wall Mount, 5/16 in x 2 1/2 in Lag Screws Kit/Hex Screws Kit, Universal TV Mounting Hardware Kit with Bubble Level and Concrete Wall Anchors-Black",https://www.amazon.com/gp/slredirect/picassoRedirect.html/ref=pa_sp_atf_next_garden_sr_pg2_1?ie=UTF8&adId=A08655332FFWF77U2Z1IQ&url=%2FUniversal-Mounting-Hardware-Concrete-Anchors-Black%2Fdp%2FB09Y2VG7H6%2Fref%3Dsr_1_27_sspa%3Fcrid%3D2THUN1PRZOBEX%26keywords%3Dfurniture%26qid%3D1654931230%26rnid%3D1063306%26s%3Dhome-garden%26sprefix%3Dfurnitu%252Caps%252C297%26sr%3D1-27-spons%26psc%3D1&qualifier=1654931230&id=4054089777504566&widgetName=sp_atf_next,https://m.media-amazon.com/images/I/71n+tpHQQiL._AC_UL320_.jpg,3.0 out of 5 stars,1,$7.99
"Palama Gold Bar Cart for The Home, Large Mid Century Bar Cart Simply Assembled in 10 Minutes, 2-Tier Rolling Storage Cart with 2 Mirrored Glass Shelves, Wine Cart with 2 Lockable Wheels",https://www.amazon.com/Palama-Gold-Assembled-Mirrored-Glass/dp/B09T8YT9GJ/ref=sr_1_28?crid=2THUN1PRZOBEX&keywords=furniture&qid=1654931230&rnid=1063306&s=home-garden&sprefix=furnitu%2Caps%2C297&sr=1-28,https://m.media-amazon.com/images/I/71RSCz+H7QL._AC_UL320_.jpg,4.0 out of 5 stars,3,$139.99
"Hillsdale Furniture Cadman Counter Stool, Dull Nickel",https://www.amazon.com/Hillsdale-Cadman-Backless-Counter-Stool/dp/B00C9P589C/ref=sr_1_29?crid=2THUN1PRZOBEX&keywords=furniture&qid=1654931230&rnid=1063306&s=home-garden&sprefix=furnitu%2Caps%2C297&sr=1-29,https://m.media-amazon.com/images/I/614pH1PW05L._AC_UL320_.jpg,4.3 out of 5 stars,40,$194.77
Flash Furniture Ergonomic Mid-Back Mesh Drafting Chair with Black Fabric Seat and Adjustable Foot Ring,https://www.amazon.com/Flash-Furniture-Ergonomic-Mid-Back-Adjustable/dp/B01N5I2SCW/ref=sr_1_30?crid=2THUN1PRZOBEX&keywords=furniture&qid=1654931230&rnid=1063306&s=home-garden&sprefix=furnitu%2Caps%2C297&sr=1-30,https://m.media-amazon.com/images/I/81m1CdqLLAL._AC_UL320_.jpg,4.3 out of 5 stars,266,$116.99
Home Source Stone Grey Corner Bar Unit with Built-in Wine Rack and Lower Cabinet,https://www.amazon.com/Home-Source-Corner-Unit-Stone/dp/B08WC2MCZL/ref=sr_1_31?crid=2THUN1PRZOBEX&keywords=furniture&qid=1654931230&rnid=1063306&s=home-garden&sprefix=furnitu%2Caps%2C297&sr=1-31,https://m.media-amazon.com/images/I/91fns48czFL._AC_UL320_.jpg,4.6 out of 5 stars,267,$399.00
"New Classic Furniture Manchester Swivel Counter Stool, 24-Inch, Antique Grey",https://www.amazon.com/New-Classic-S1128-CS-FG-Manchester-Counter/dp/B07FRLJ3C1/ref=sr_1_32?crid=2THUN1PRZOBEX&keywords=furniture&qid=1654931230&rnid=1063306&s=home-garden&sprefix=furnitu%2Caps%2C297&sr=1-32,https://m.media-amazon.com/images/I/617GFyltJDL._AC_UL320_.jpg,4.3 out of 5 stars,715,$170.20
"Richohome 6 "" Heavy Duty Bar Stool 360°Swivel Replacement Seat Swivel Base Bar Stool Swivel Plate for Bar Stool, Chair, Boat, Square Swivel Furniture Replacement (Ball Bearing)",https://www.amazon.com/Richohome-360%C2%B0Swivel-Replacement-Furniture-Bearing/dp/B09MG2JCKC/ref=sr_1_33?crid=2THUN1PRZOBEX&keywords=furniture&qid=1654931230&rnid=1063306&s=home-garden&sprefix=furnitu%2Caps%2C297&sr=1-33,https://m.media-amazon.com/images/I/61t6bdKBjyL._AC_UL320_.jpg,,,$15.99
"Giant Fur Bean Bag Chair for Adult Living Room Furniture Big Round Soft Fluffy Faux Fur BeanBag Lazy Sofa Bed Cover(it was only a Cover, not a Full Bean Bag)Faux Fur BeanBag Lazy Sofa Bed Cover Giant",https://www.amazon.com/Giant-Living-Furniture-Fluffy-BeanBag/dp/B09M3BSLBY/ref=sr_1_34?crid=2THUN1PRZOBEX&keywords=furniture&qid=1654931230&rnid=1063306&s=home-garden&sprefix=furnitu%2Caps%2C297&sr=1-34,https://m.media-amazon.com/images/I/71vl+V6r4jS._AC_UL320_.jpg,3.2 out of 5 stars,89,$111.00
"Vicodabo Floating Wall TV Cabinet Stand with Power Outlet, 55"" Wall Mounted Wood Media Console with Cable Holes, Modern Entertainment Center Storage Rack for Living Room,Bedroom (Black)",https://www.amazon.com/Vicodabo-Floating-Cabinet-Mounted-Entertainment/dp/B09TK1Q2ZD/ref=sr_1_25?crid=2THUN1PRZOBEX&keywords=furniture&qid=1654931230&rnid=1063306&s=home-garden&sprefix=furnitu%2Caps%2C297&sr=1-25,https://m.media-amazon.com/images/I/61+aGLfwwcL._AC_UL320_.jpg,,,$89.99
"Roundhill Furniture Ellston Upholstered Adjustable Swivel Barstools in Blue, Set of 2",https://www.amazon.com/Roundhill-Furniture-Upholstered-Adjustable-Barstools/dp/B08SHWMJYC/ref=sr_1_26?crid=2THUN1PRZOBEX&keywords=furniture&qid=1654931230&rnid=1063306&s=home-garden&sprefix=furnitu%2Caps%2C297&sr=1-26,https://m.media-amazon.com/images/I/91h8hBupgTL._AC_UL320_.jpg,4.5 out of 5 stars,109,$179.90
Chill Sack Bean Bag Chair: Huge 6' Memory Foam Furniture Bag and Large Lounger - Big Sofa with Soft Micro Fiber Cover - Charcoal,https://www.amazon.com/Chill-Sack-Bean-Bag-Chair/dp/B00P21UU5W/ref=sr_1_27?crid=2THUN1PRZOBEX&keywords=furniture&qid=1654931230&rnid=1063306&s=home-garden&sprefix=furnitu%2Caps%2C297&sr=1-27,https://m.media-amazon.com/images/I/71kX6hCtGbL._AC_UL320_.jpg,4.2 out of 5 stars,"1,683",$302.99
"Hillsdale Furniture Phoenix Counter Height Stool (Set of 2), Gray",https://www.amazon.com/Hillsdale-Furniture-Phoenix-Counter-Height/dp/B07TWYJZFF/ref=sr_1_28?crid=2THUN1PRZOBEX&keywords=furniture&qid=1654931230&rnid=1063306&s=home-garden&sprefix=furnitu%2Caps%2C297&sr=1-28,https://m.media-amazon.com/images/I/81HWMKyyJ9L._AC_UL320_.jpg,4.3 out of 5 stars,86,$278.34
"Roundhill Furniture Masaccio Cushioned Leatherette Upholstery Airlift Adjustable Swivel Barstool with Chrome Base, White",https://www.amazon.com/Roundhill-Furniture-Cushioned-Leatherette-Upholstery/dp/B01EVLE9LY/ref=sr_1_29?crid=2THUN1PRZOBEX&keywords=furniture&qid=1654931230&rnid=1063306&s=home-garden&sprefix=furnitu%2Caps%2C297&sr=1-29,https://m.media-amazon.com/images/I/81DYlFonsqL._AC_UL320_.jpg,4.4 out of 5 stars,"3,130",$144.42
Miereirl Bar Stools Set of 2 Morden Height Counter Bar Stools with Polypropylene Back and Leather Seat，Swivel Adjustable Stool Chair for Home Kitchen Island-Black,https://www.amazon.com/gp/slredirect/picassoRedirect.html/ref=pa_sp_mtf_garden_sr_pg2_1?ie=UTF8&adId=A01108211FMULWOKHQ6QL&url=%2FMiereirl-Polypropylene-Seat%25EF%25BC%258CSwivel-Adjustable-Island-Black%2Fdp%2FB09XDQZ7H8%2Fref%3Dsr_1_30_sspa%3Fcrid%3D2THUN1PRZOBEX%26keywords%3Dfurniture%26qid%3D1654931230%26rnid%3D1063306%26s%3Dhome-garden%26sprefix%3Dfurnitu%252Caps%252C297%26sr%3D1-30-spons%26psc%3D1&qualifier=1654931230&id=4054089777504566&widgetName=sp_mtf,https://m.media-amazon.com/images/I/710C84C5bcL._AC_UL320_.jpg,,,$109.99
"AVF FS900VARWB-A TV Stand, Walnut",https://www.amazon.com/gp/slredirect/picassoRedirect.html/ref=pa_sp_mtf_garden_sr_pg2_1?ie=UTF8&adId=A10058722SHB9UTIPKI5M&url=%2FAVF-FS900VARWB-Varano-Corner-Walnut%2Fdp%2FB01GC9TETK%2Fref%3Dsr_1_31_sspa%3Fcrid%3D2THUN1PRZOBEX%26keywords%3Dfurniture%26qid%3D1654931230%26rnid%3D1063306%26s%3Dhome-garden%26sprefix%3Dfurnitu%252Caps%252C297%26sr%3D1-31-spons%26psc%3D1&qualifier=1654931230&id=4054089777504566&widgetName=sp_mtf,https://m.media-amazon.com/images/I/81QDZ4CXArL._AC_UL320_.jpg,3.9 out of 5 stars,56,$96.99
"Sophia & William Bar Stool Counter Height Bar Stool for Kitchen Island,Adjustable Swivel Bar Stool with Back, Modern PU Leather Padded Kitchen Dining Stool Sturdy Footrest Large Base ,300lbs,Grey,1PC",https://www.amazon.com/gp/slredirect/picassoRedirect.html/ref=pa_sp_mtf_garden_sr_pg2_1?ie=UTF8&adId=A03584661N0WNGK6RVL8U&url=%2FSophia-William-Upholstered-Resistant-Footrest%2Fdp%2FB08CKT3T4T%2Fref%3Dsr_1_32_sspa%3Fcrid%3D2THUN1PRZOBEX%26keywords%3Dfurniture%26qid%3D1654931230%26rnid%3D1063306%26s%3Dhome-garden%26sprefix%3Dfurnitu%252Caps%252C297%26sr%3D1-32-spons%26psc%3D1&qualifier=1654931230&id=4054089777504566&widgetName=sp_mtf,https://m.media-amazon.com/images/I/81KFaOsRajS._AC_UL320_.jpg,4.0 out of 5 stars,46,$159.96
Flash Furniture Adjustable Bar Stools | Set of 2 Brown Counter Height Barstools with Back and Armrest,https://www.amazon.com/Flash-Furniture-Contemporary-Adjustable-Barstool/dp/B00FEANWJW/ref=sr_1_33?crid=2THUN1PRZOBEX&keywords=furniture&qid=1654931230&rnid=1063306&s=home-garden&sprefix=furnitu%2Caps%2C297&sr=1-33,https://m.media-amazon.com/images/I/81LRVu4ksLS._AC_UL320_.jpg,4.1 out of 5 stars,535,$284.80
