Title,Url,Image,Avg_ratings,Num_ratings,Price
"Lorvain Folable Makeup Artist Stool Chair, Protable Tall Folding Directors Chair, Aluminum Makeup Chair with Head Rest for Studio Salon Vanity, Bar Height - Black Chair",https://www.amazon.com/Lorvain-Folable-Protable-Directors-Aluminum/dp/B09TW5Y768/ref=sr_1_446?crid=2THUN1PRZOBEX&keywords=furniture&qid=1654931513&rnid=1063306&s=home-garden&sprefix=furnitu%2Caps%2C297&sr=1-446,https://m.media-amazon.com/images/I/61H7fcZALIL._AC_UL320_.jpg,,,$169.99
"AT-VALY Folding Dining Table with 2 Storage Open Shelf,Drop Leaf Extension Dining Table,Top Folding 15.7"" to 55.1"" Kitchen Table (Gold)",https://www.amazon.com/AT-VALY-Folding-Storage-Extension-Kitchen/dp/B09K3BHM1B/ref=sr_1_447?crid=2THUN1PRZOBEX&keywords=furniture&qid=1654931513&rnid=1063306&s=home-garden&sprefix=furnitu%2Caps%2C297&sr=1-447,https://m.media-amazon.com/images/I/71FNVUc1nCL._AC_UL320_.jpg,4.5 out of 5 stars,2,$219.99
"Carlisle XDL3000H03 Cateraide Polyethylene Dolly with Handle, 28-3/4"" Length x 22-3/8"" Width x 5"" Depth, Black",https://www.amazon.com/gp/slredirect/picassoRedirect.html/ref=pa_sp_mtf_garden_sr_pg19_1?ie=UTF8&adId=A0443096DDN0SQIWFI7Z&url=%2FCarlisle-Cateraide-XT3000R-Top-Loading-Carrier%2Fdp%2FB002MVF3AW%2Fref%3Dsr_1_448_sspa%3Fcrid%3D2THUN1PRZOBEX%26keywords%3Dfurniture%26qid%3D1654931513%26rnid%3D1063306%26s%3Dhome-garden%26sprefix%3Dfurnitu%252Caps%252C297%26sr%3D1-448-spons%26psc%3D1&qualifier=1654931513&id=6118599724699002&widgetName=sp_mtf,https://m.media-amazon.com/images/I/71V7jUOfBmS._AC_UL320_.jpg,4.4 out of 5 stars,2,$262.49
"WALI TV Top Shelf, 23.6 x 5 Inch Flat Panel for Streaming Devices, Media Boxes, Speakers and Home Decor (TSH002), 1 Pack, Black",https://www.amazon.com/gp/slredirect/picassoRedirect.html/ref=pa_sp_mtf_garden_sr_pg19_1?ie=UTF8&adId=A086622226T4PO5C5REVQ&url=%2FWALI-Streaming-Devices-Speakers-TSH002%2Fdp%2FB07PXHW2M8%2Fref%3Dsr_1_449_sspa%3Fcrid%3D2THUN1PRZOBEX%26keywords%3Dfurniture%26qid%3D1654931513%26rnid%3D1063306%26s%3Dhome-garden%26sprefix%3Dfurnitu%252Caps%252C297%26sr%3D1-449-spons%26psc%3D1%26smid%3DA2K3WARBVMJ9U9&qualifier=1654931513&id=6118599724699002&widgetName=sp_mtf,https://m.media-amazon.com/images/I/719UozyaSvL._AC_UL320_.jpg,4.7 out of 5 stars,"1,013",$24.99
"40pcs Furniture Glide,Screw-on Felt Pad Slider Floor Protector for Wooden Leg Feet of Chair Table Sofa(Φ20mm or 0.8"",Brown)",https://www.amazon.com/gp/slredirect/picassoRedirect.html/ref=pa_sp_mtf_garden_sr_pg19_1?ie=UTF8&adId=A0079517191HO2XUU8GHL&url=%2FFurniture-Screw-Slider-Protector-Wooden%2Fdp%2FB07GNDM8YD%2Fref%3Dsr_1_450_sspa%3Fcrid%3D2THUN1PRZOBEX%26keywords%3Dfurniture%26qid%3D1654931513%26rnid%3D1063306%26s%3Dhome-garden%26sprefix%3Dfurnitu%252Caps%252C297%26sr%3D1-450-spons%26psc%3D1&qualifier=1654931513&id=6118599724699002&widgetName=sp_mtf,https://m.media-amazon.com/images/I/61X3khkVWLL._AC_UL320_.jpg,4.7 out of 5 stars,"2,960",$8.99
TechOrbits Artistic Easel 45 65 Inch Screens - Portable TV Floor Stand - Universal TV Display Stand Tripod Base Height Adjustable with Swivel,https://www.amazon.com/TechOrbits-Portable-Floor-Stand-Universal/dp/B086WS2YJ9/ref=sr_1_451?crid=2THUN1PRZOBEX&keywords=furniture&qid=1654931513&rnid=1063306&s=home-garden&sprefix=furnitu%2Caps%2C297&sr=1-451,https://m.media-amazon.com/images/I/91ENncukX+L._AC_UL320_.jpg,4.8 out of 5 stars,297,$101.99
"Hillsdale Napa Valley Swivel Counter Height Stool, Dark Brown Cherry, 4294-827I",https://www.amazon.com/Hillsdale-Valley-Swivel-Counter-Stool/dp/B00BPN6WSA/ref=sr_1_452?crid=2THUN1PRZOBEX&keywords=furniture&qid=1654931513&rnid=1063306&s=home-garden&sprefix=furnitu%2Caps%2C297&sr=1-452,https://m.media-amazon.com/images/I/51dVeQnPhzL._AC_UL320_.jpg,4.4 out of 5 stars,91,$186.53
"Roundhill Furniture Arnhem Wood Upholstered Swivel Counter Height Stools, Set of 2, Gray",https://www.amazon.com/Roundhill-Furniture-Arnhem-Upholstered-Counter/dp/B085ZB4SZM/ref=sr_1_453?crid=2THUN1PRZOBEX&keywords=furniture&qid=1654931513&rnid=1063306&s=home-garden&sprefix=furnitu%2Caps%2C297&sr=1-453,https://m.media-amazon.com/images/I/91m4WpP7phL._AC_UL320_.jpg,3.8 out of 5 stars,13,$125.60
"Tommy Bahama Blue, 2 Count",https://www.amazon.com/Tommy-Bahama-2pack-Blue/dp/B0854HPJ41/ref=sr_1_454?crid=2THUN1PRZOBEX&keywords=furniture&qid=1654931513&rnid=1063306&s=home-garden&sprefix=furnitu%2Caps%2C297&sr=1-454,https://m.media-amazon.com/images/I/61y8ZQb427L._AC_UL320_.jpg,4.6 out of 5 stars,"1,831",$228.98
"Christopher Knight Home Lisette Backless Leather Counter Stools, 2-Pcs Set, Ivory",https://www.amazon.com/Christopher-Knight-Home-238557-Nailheads/dp/B00J5TAMUU/ref=sr_1_455?crid=2THUN1PRZOBEX&keywords=furniture&qid=1654931513&rnid=1063306&s=home-garden&sprefix=furnitu%2Caps%2C297&sr=1-455,https://m.media-amazon.com/images/I/61m8cXt87+L._AC_UL320_.jpg,4.7 out of 5 stars,861,$194.99
"Kings Brand Furniture Wood TV Stand with Storage, Espresso",https://www.amazon.com/Kings-Brand-Furniture-Storage-Espresso/dp/B0181FBVA8/ref=sr_1_456?crid=2THUN1PRZOBEX&keywords=furniture&qid=1654931513&rnid=1063306&s=home-garden&sprefix=furnitu%2Caps%2C297&sr=1-456,https://m.media-amazon.com/images/I/81h2vojoMDL._AC_UL320_.jpg,5.0 out of 5 stars,1,$209.91
"Sofa Sack - Plush, Ultra Soft Bean Bag Chair - Memory Foam Bean Bag Chair with Microsuede Cover - Stuffed Foam Filled Furniture and Accessories for Dorm Room - Purple",https://www.amazon.com/Sofa-Sack-Microsuede-Furniture-Accessories/dp/B019OGU7IA/ref=sr_1_457?crid=2THUN1PRZOBEX&keywords=furniture&qid=1654931513&rnid=1063306&s=home-garden&sprefix=furnitu%2Caps%2C297&sr=1-457,https://m.media-amazon.com/images/I/71-hqLN7e9L._AC_UL320_.jpg,4.2 out of 5 stars,126,$89.99
"Butterfly Craze Bean Bag Chair Cover (Stuffing Not Included) – Toddler Toy Organizer – Fill with Stuffed Animals to Create a Jumbo, Comfy Floor Lounger for Boy’s or Girl’s Bedroom – Purple Polka Dots",https://www.amazon.com/Butterfly-Craze-Stuffed-Animal-Storage/dp/B07GNWXPB6/ref=sr_1_458?crid=2THUN1PRZOBEX&keywords=furniture&qid=1654931513&rnid=1063306&s=home-garden&sprefix=furnitu%2Caps%2C297&sr=1-458,https://m.media-amazon.com/images/I/81WUiOXp+OL._AC_UL320_.jpg,4.0 out of 5 stars,"4,175",$27.99
"Flash Furniture 30"" High Backless Mint Green Barstool with Square Wood Seat",https://www.amazon.com/Flash-Furniture-BT3503-30-MINT-WD-GG-Restaurant-Barstools/dp/B07H4F1HBC/ref=sr_1_459?crid=2THUN1PRZOBEX&keywords=furniture&qid=1654931513&rnid=1063306&s=home-garden&sprefix=furnitu%2Caps%2C297&sr=1-459,https://m.media-amazon.com/images/I/716uryBWEBL._AC_UL320_.jpg,4.3 out of 5 stars,7,$77.99
"WALI Universal TV Stand Tabletop, for Most 22 to 65 inch LCD Flat Screen TV, VESA up to 800 by 400mm (TVS001), Black",https://www.amazon.com/WALI-Universal-Stand-Screen-TVS001/dp/B01HE1IVNA/ref=sr_1_460?crid=2THUN1PRZOBEX&keywords=furniture&qid=1654931513&rnid=1063306&s=home-garden&sprefix=furnitu%2Caps%2C297&sr=1-460,https://m.media-amazon.com/images/I/61zQNcrsYuS._AC_UL320_.jpg,4.5 out of 5 stars,"33,356",$19.99
American Furniture Alliance Fun Factory Classic Large Bean Bag Black,https://www.amazon.com/American-Furniture-Alliance-Fun-Factory/dp/B005I6BHQM/ref=sr_1_461?crid=2THUN1PRZOBEX&keywords=furniture&qid=1654931513&rnid=1063306&s=home-garden&sprefix=furnitu%2Caps%2C297&sr=1-461,https://m.media-amazon.com/images/I/91X7T6x5SgL._AC_UL320_.jpg,3.5 out of 5 stars,41,$68.72
"Christopher Knight Home Waldo Reconstituted Leather Counter Stools, 2-Pcs Set, Chocolate Brown",https://www.amazon.com/Christopher-Knight-Home-296630-Furniture/dp/B01BN1VCHO/ref=sr_1_462?crid=2THUN1PRZOBEX&keywords=furniture&qid=1654931513&rnid=1063306&s=home-garden&sprefix=furnitu%2Caps%2C297&sr=1-462,https://m.media-amazon.com/images/I/71coyBCyyQL._AC_UL320_.jpg,4.4 out of 5 stars,16,$359.99
"Sunnydaze Meranti Wood Outdoor Dining Arm Chair with Teak Oil Finish - Set of 2 - Modern Rustic Outdoor Furniture - Comfortable Patio Seating - Perfect for The Front Porch, Backyard, Patio or Balcony",https://www.amazon.com/gp/slredirect/picassoRedirect.html/ref=pa_sp_btf_garden_sr_pg19_1?ie=UTF8&adId=A07733111CLYSSE10GT67&url=%2FSunnydaze-Meranti-Outdoor-Dining-Finish%2Fdp%2FB08GL2FXV2%2Fref%3Dsr_1_463_sspa%3Fcrid%3D2THUN1PRZOBEX%26keywords%3Dfurniture%26qid%3D1654931513%26rnid%3D1063306%26s%3Dhome-garden%26sprefix%3Dfurnitu%252Caps%252C297%26sr%3D1-463-spons%26psc%3D1&qualifier=1654931513&id=6118599724699002&widgetName=sp_btf,https://m.media-amazon.com/images/I/81iesCI6YZL._AC_UL320_.jpg,4.2 out of 5 stars,18,$215.00
Sunnydaze Rolling Gardening Chair Cart with Wheels - Full Range 360 Swivel Seat with Adjustable Height - Utility Tool Tray and Storage Basket - Green,https://www.amazon.com/gp/slredirect/picassoRedirect.html/ref=pa_sp_btf_garden_sr_pg19_1?ie=UTF8&adId=A08478143E0WBSS0TWNTB&url=%2FSunnydaze-Rolling-Scooter-Utility-Storage%2Fdp%2FB011VNMYG2%2Fref%3Dsr_1_464_sspa%3Fcrid%3D2THUN1PRZOBEX%26keywords%3Dfurniture%26qid%3D1654931513%26rnid%3D1063306%26s%3Dhome-garden%26sprefix%3Dfurnitu%252Caps%252C297%26sr%3D1-464-spons%26psc%3D1&qualifier=1654931513&id=6118599724699002&widgetName=sp_btf,https://m.media-amazon.com/images/I/719rNjvC9OL._AC_UL320_.jpg,4.3 out of 5 stars,139,$135.00
"2Pack 8” Heavy Duty Bar Stool Swivel Plate, 360°Square Rotating Swivel Plate, Bar Stool Seat Turntable, Mount Plate for Recliner Chair Bar Stool Square Swivel Furniture Replacement",https://www.amazon.com/gp/slredirect/picassoRedirect.html/ref=pa_sp_btf_garden_sr_pg19_1?ie=UTF8&adId=A0386769X6LQBR89B5Y6&url=%2F360%25C2%25B0Square-Rotating-Turntable-Furniture-Replacement%2Fdp%2FB09W6398TC%2Fref%3Dsr_1_465_sspa%3Fcrid%3D2THUN1PRZOBEX%26keywords%3Dfurniture%26qid%3D1654931513%26rnid%3D1063306%26s%3Dhome-garden%26sprefix%3Dfurnitu%252Caps%252C297%26sr%3D1-465-spons%26psc%3D1&qualifier=1654931513&id=6118599724699002&widgetName=sp_btf,https://m.media-amazon.com/images/I/71HCGS4knNL._AC_UL320_.jpg,,,$25.99
"Wobble Wedges Flexible Plastic Shims, 30 Pack - Multi-Purpose Shim Wedges for Home Improvement and Work - Plastic Wedge, Table Shims, Toilet Shims, and Furniture Levelers - Clear Wedges, Leveling Feet",https://www.amazon.com/gp/slredirect/picassoRedirect.html/ref=pa_sp_atf_next_garden_sr_pg26_1?ie=UTF8&adId=A02179963H8WNG3LZ7LLD&url=%2FWobble-Wedges-Furniture-Plumbing-Installation%2Fdp%2FB00LVQGGKA%2Fref%3Dsr_1_601_sspa%3Fcrid%3D2THUN1PRZOBEX%26keywords%3Dfurniture%26qid%3D1654931783%26rnid%3D1063306%26s%3Dhome-garden%26sprefix%3Dfurnitu%252Caps%252C297%26sr%3D1-601-spons%26psc%3D1&qualifier=1654931783&id=1455459504582092&widgetName=sp_atf_next,https://m.media-amazon.com/images/I/71k5tZSlXLL._AC_UL320_.jpg,4.7 out of 5 stars,"2,163",$13.99
"Finnhomy Bar Stools Set of 2 Counter Height, Swivel Barstools with Footrest and Thicken Cushion Back, Height Adjustable Modern Bar stools for Kitchen, Vintage Leather, Retro Brown",https://www.amazon.com/gp/slredirect/picassoRedirect.html/ref=pa_sp_atf_next_garden_sr_pg26_1?ie=UTF8&adId=A04814832ARQ7N4YIL4KH&url=%2FFinnhomy-Counter-Barstools-Footrest-Adjustable%2Fdp%2FB09N3RK7R4%2Fref%3Dsr_1_602_sspa%3Fcrid%3D2THUN1PRZOBEX%26keywords%3Dfurniture%26qid%3D1654931783%26rnid%3D1063306%26s%3Dhome-garden%26sprefix%3Dfurnitu%252Caps%252C297%26sr%3D1-602-spons%26psc%3D1&qualifier=1654931783&id=1455459504582092&widgetName=sp_atf_next,https://m.media-amazon.com/images/I/71F0mWK8-EL._AC_UL320_.jpg,5.0 out of 5 stars,1,$159.99
"ErgoDesign Bar Stools Set of 2, Square Backless Adjustable Bar Stools, Swivel Bar Stool, Barstools Set of 2 (Light Grey)",https://www.amazon.com/gp/slredirect/picassoRedirect.html/ref=pa_sp_atf_next_garden_sr_pg26_1?ie=UTF8&adId=A07189831B6XK6IH54LXO&url=%2FErgoDesign-Stools-Backless-Adjustable-Barstools%2Fdp%2FB091KHB98L%2Fref%3Dsr_1_603_sspa%3Fcrid%3D2THUN1PRZOBEX%26keywords%3Dfurniture%26qid%3D1654931783%26rnid%3D1063306%26s%3Dhome-garden%26sprefix%3Dfurnitu%252Caps%252C297%26sr%3D1-603-spons%26psc%3D1&qualifier=1654931783&id=1455459504582092&widgetName=sp_atf_next,https://m.media-amazon.com/images/I/61vru+CMCiS._AC_UL320_.jpg,4.6 out of 5 stars,61,$104.99
"FUBIRUO Industrial Bar Stool Vintage Farmhouse Kitchen Stool Counter Height Bar Stools Adjustable Swivel Bar Stool Metal Stool Kitchen Island Bar Stool Set of 2 (Black 2pcs, Wooden Top)",https://www.amazon.com/FUBIRUO-Industrial-Vintage-Farmhouse-Adjustable/dp/B08PFMTQY5/ref=sr_1_604?crid=2THUN1PRZOBEX&keywords=furniture&qid=1654931783&rnid=1063306&s=home-garden&sprefix=furnitu%2Caps%2C297&sr=1-604,https://m.media-amazon.com/images/I/61zPYaq3gDL._AC_UL320_.jpg,4.5 out of 5 stars,34,$147.99
"Diwhy Industrial Vintage Bar Stool,Kitchen Counter Height Adjustable Pipe Stool,Cast Iron Stool,Swivel Bar Stool with Backrest,Metal Stool,Silver,Fully Welded Set of 2 (Wooden Top)",https://www.amazon.com/Diwhy-Industrial-Vintage-Kitchen-Adjustable/dp/B07XNY8B4B/ref=sr_1_605?crid=2THUN1PRZOBEX&keywords=furniture&qid=1654931783&rnid=1063306&s=home-garden&sprefix=furnitu%2Caps%2C297&sr=1-605,https://m.media-amazon.com/images/I/610uY30pGIS._AC_UL320_.jpg,4.3 out of 5 stars,225,$202.90
"Usinso Industrial Kitchen Serving Carts Rolling Bar Cart with 3 Tier Storage Shelves bar carts for The Home with Wine Glass Holder,Lockable Caster Liquor Cart Removable Top Box Container",https://www.amazon.com/charaHOME-Industrial-Lockable-Removable-Container/dp/B089CFRZVN/ref=sr_1_606?crid=2THUN1PRZOBEX&keywords=furniture&qid=1654931783&rnid=1063306&s=home-garden&sprefix=furnitu%2Caps%2C297&sr=1-606,https://m.media-amazon.com/images/I/71hASo6KNoS._AC_UL320_.jpg,4.5 out of 5 stars,254,$139.99
"Hillsdale Boyle Upholstered Metal Counter Height Stool with Curved Low Back, Black",https://www.amazon.com/Hillsdale-Upholstered-Counter-Height-Curved/dp/B098RD756Q/ref=sr_1_607?crid=2THUN1PRZOBEX&keywords=furniture&qid=1654931783&rnid=1063306&s=home-garden&sprefix=furnitu%2Caps%2C297&sr=1-607,https://m.media-amazon.com/images/I/41oI75oIiwL._AC_UL320_.jpg,5.0 out of 5 stars,2,$130.22
"Mount-It! RV TV Mount, Lockable Full Motion TV Wall Mount Designed Specifically for RV or Mobile Home Use Single Arm Tilting and Swiveling 42 Inches Max, 33 Lb Capacity, VESA 200 Compatible",https://www.amazon.com/Mount-Lockable-Specifically-Swiveling-Compatible/dp/B01F2OZ0VM/ref=sr_1_608?crid=2THUN1PRZOBEX&keywords=furniture&qid=1654931783&rnid=1063306&s=home-garden&sprefix=furnitu%2Caps%2C297&sr=1-608,https://m.media-amazon.com/images/I/61+71uyWr2L._AC_UL320_.jpg,4.5 out of 5 stars,"2,898",$43.48
Christopher Knight Home Morse Bar Cart 3-Tiers Solid Acacia Wood Brown Mahogany Finish,https://www.amazon.com/Morse-3-Tiers-Acacia-Mahogany-Finish/dp/B07H3PD2NG/ref=sr_1_609?crid=2THUN1PRZOBEX&keywords=furniture&qid=1654931783&rnid=1063306&s=home-garden&sprefix=furnitu%2Caps%2C297&sr=1-609,https://m.media-amazon.com/images/I/71K9pYONRRL._AC_UL320_.jpg,4.4 out of 5 stars,23,$124.29
"Hillsdale Rosabella Wood Swivel Bar Height Stool, Counter, White",https://www.amazon.com/Hillsdale-Rosabella-Swivel-Height-Counter/dp/B096N7ZYBG/ref=sr_1_610?crid=2THUN1PRZOBEX&keywords=furniture&qid=1654931783&rnid=1063306&s=home-garden&sprefix=furnitu%2Caps%2C297&sr=1-610,https://m.media-amazon.com/images/I/41hGYCupeaL._AC_UL320_.jpg,,,$199.60
Gaming Chair Cinnamoroll WCG Gaming Chair Girls Cute Computer Armchair Office Home Swivel Lifting Adjustable Chair,https://www.amazon.com/Cinnamoroll-Computer-Armchair-Lifting-Adjustable/dp/B09TZWT5MN/ref=sr_1_611?crid=2THUN1PRZOBEX&keywords=furniture&qid=1654931783&rnid=1063306&s=home-garden&sprefix=furnitu%2Caps%2C297&sr=1-611,https://m.media-amazon.com/images/I/51-5IbKcV4L._AC_UL320_.jpg,,,$230.99
Prosumer's Choice Bamboo 360 Degree Rotating Flat Screen TV Stand with Home Entertainment Shelf,https://www.amazon.com/Prosumers-Choice-Bamboo-Rotating-Entertainment/dp/B01LZS2KD9/ref=sr_1_612?crid=2THUN1PRZOBEX&keywords=furniture&qid=1654931783&rnid=1063306&s=home-garden&sprefix=furnitu%2Caps%2C297&sr=1-612,https://m.media-amazon.com/images/I/813t9gL4MrL._AC_UL320_.jpg,4.5 out of 5 stars,60,
Ball & Cast Kitchen Room Counter Stool 30 Inch Seat Height Brown Set of 2,https://www.amazon.com/Ball-Cast-HSA-7002-30-Kitchen-Stool/dp/B085NWH3K7/ref=sr_1_613?crid=2THUN1PRZOBEX&keywords=furniture&qid=1654931783&rnid=1063306&s=home-garden&sprefix=furnitu%2Caps%2C297&sr=1-613,https://m.media-amazon.com/images/I/81w61ASaUvS._AC_UL320_.jpg,4.3 out of 5 stars,19,$142.48
"GOLASON Gold Bar Cart with 3 Shelves, Wine Glass Bottle Storage Bar Serving Cart with Wheels for Kitchen Living Room (31.5”W, White)",https://www.amazon.com/GOLASON-Shelves-Storage-Serving-Kitchen/dp/B097L1RVW7/ref=sr_1_614?crid=2THUN1PRZOBEX&keywords=furniture&qid=1654931783&rnid=1063306&s=home-garden&sprefix=furnitu%2Caps%2C297&sr=1-614,https://m.media-amazon.com/images/I/71MiesOfbNL._AC_UL320_.jpg,4.0 out of 5 stars,6,$139.99
"VIVO Electric Ceiling TV Mount for 23 to 55 inch Screens, Flip Down Motorized Pitched Roof VESA Mount, MOUNT-E-FD55",https://www.amazon.com/VIVO-Electric-Motorized-Pitched-Ceiling/dp/B01GGR6I24/ref=sr_1_615?crid=2THUN1PRZOBEX&keywords=furniture&qid=1654931783&rnid=1063306&s=home-garden&sprefix=furnitu%2Caps%2C297&sr=1-615,https://m.media-amazon.com/images/I/71Hph3ZZH-L._AC_UL320_.jpg,4.6 out of 5 stars,"2,011",$179.99
Fefances Counter Height Bar Stool Swivel Bar Stools Kitchen Island Stools Velvet Bar Chair Height Adjustable with Black Metal Base Dark Green,https://www.amazon.com/gp/slredirect/picassoRedirect.html/ref=pa_sp_mtf_garden_sr_pg26_1?ie=UTF8&adId=A08212469QT22B35NSUB&url=%2FFefances-Counter-Height-Kitchen-Adjustable%2Fdp%2FB09PV9T23V%2Fref%3Dsr_1_616_sspa%3Fcrid%3D2THUN1PRZOBEX%26keywords%3Dfurniture%26qid%3D1654931783%26rnid%3D1063306%26s%3Dhome-garden%26sprefix%3Dfurnitu%252Caps%252C297%26sr%3D1-616-spons%26psc%3D1&qualifier=1654931783&id=1455459504582092&widgetName=sp_mtf,https://m.media-amazon.com/images/I/51gLGGBDVVL._AC_UL320_.jpg,4.5 out of 5 stars,15,$127.99
"Finnhomy Bar Stools Set of 2 Counter Height, Swivel Barstools with Footrest and L Shape Thicken Cushion Back Handle, Height Adjustable Modern Bar stools for Kitchen, Velvet Fabric, Dark Grey",https://www.amazon.com/gp/slredirect/picassoRedirect.html/ref=pa_sp_mtf_garden_sr_pg26_1?ie=UTF8&adId=A09236451SR7HVEFAT8SK&url=%2FFinnhomy-Counter-Barstools-Footrest-Adjustable%2Fdp%2FB09N3RF9N6%2Fref%3Dsr_1_617_sspa%3Fcrid%3D2THUN1PRZOBEX%26keywords%3Dfurniture%26qid%3D1654931783%26rnid%3D1063306%26s%3Dhome-garden%26sprefix%3Dfurnitu%252Caps%252C297%26sr%3D1-617-spons%26psc%3D1&qualifier=1654931783&id=1455459504582092&widgetName=sp_mtf,https://m.media-amazon.com/images/I/81nLecSyrgL._AC_UL320_.jpg,,,$159.99
"beaskin Bar Cart,Exquisitely Hand-Carved Wood 2-Tier Bar Carts for The Home with Wine Rack Guardrail and Armrest,Bar Serving Cart on Universal Wheels with Brake Function 31.5"" Hx23.7 Lx15.7 W",https://www.amazon.com/gp/slredirect/picassoRedirect.html/ref=pa_sp_mtf_garden_sr_pg26_1?ie=UTF8&adId=A07049361OUMVFQT3T6WO&url=%2Fbeaskin-Exquisitely-Hand-Carved-Guardrail-Universal%2Fdp%2FB09ZVDT2T4%2Fref%3Dsr_1_618_sspa%3Fcrid%3D2THUN1PRZOBEX%26keywords%3Dfurniture%26qid%3D1654931783%26rnid%3D1063306%26s%3Dhome-garden%26sprefix%3Dfurnitu%252Caps%252C297%26sr%3D1-618-spons%26psc%3D1&qualifier=1654931783&id=1455459504582092&widgetName=sp_mtf,https://m.media-amazon.com/images/I/61Qc4DazLtL._AC_UL320_.jpg,4.5 out of 5 stars,4,$119.99
"GIA 24-Inch Counter Height Metal Stool Chair, Matte Black, Set of 3",https://www.amazon.com/GIA-24-Inch-Counter-Height-Metal/dp/B09B83G9GW/ref=sr_1_619?crid=2THUN1PRZOBEX&keywords=furniture&qid=1654931783&rnid=1063306&s=home-garden&sprefix=furnitu%2Caps%2C297&sr=1-619,https://m.media-amazon.com/images/I/41-Kq-a-S0L._AC_UL320_.jpg,,,$169.99
"Christopher Knight Home Lopez Leather Counter Stools, 2-Pcs Set, Hazelnut",https://www.amazon.com/Great-Deal-Furniture-237523-Hazelnut/dp/B00937JG6U/ref=sr_1_620?crid=2THUN1PRZOBEX&keywords=furniture&qid=1654931783&rnid=1063306&s=home-garden&sprefix=furnitu%2Caps%2C297&sr=1-620,https://m.media-amazon.com/images/I/71cfR9QJuGL._AC_UL320_.jpg,4.1 out of 5 stars,32,$257.13
"Hillsdale Dartford Swivel Stool, Counter, Dark Brown Cherry",https://www.amazon.com/Hillsdale-Dartford-Swivel-Counter-Stool/dp/B00AVZMJ2Q/ref=sr_1_621?crid=2THUN1PRZOBEX&keywords=furniture&qid=1654931783&rnid=1063306&s=home-garden&sprefix=furnitu%2Caps%2C297&sr=1-621,https://m.media-amazon.com/images/I/519H9Wob5QL._AC_UL320_.jpg,4.3 out of 5 stars,114,$190.06
"STAKMORE Straight Edge 32"" Square Folding Card Table, Cherry Finish",https://www.amazon.com/MECO-0056-00791-Straight-Folding-Cherry/dp/B0007IIJQM/ref=sr_1_622?crid=2THUN1PRZOBEX&keywords=furniture&qid=1654931783&rnid=1063306&s=home-garden&sprefix=furnitu%2Caps%2C297&sr=1-622,https://m.media-amazon.com/images/I/81L+Rchk6OL._AC_UL320_.jpg,4.7 out of 5 stars,"4,492",$72.98
"TAVR Floor TV Stand with Swivel Mount for Most 26 to 65 Inch LCD LED OLED Plasma Flat/Curved Screen TVs, Skinny TV Stand Bedroom with Height Adjustable Cable Management for Media Storage, Black",https://www.amazon.com/TAVR-Universal-Adjustable-Management-Storage/dp/B08CZTVVLZ/ref=sr_1_623?crid=2THUN1PRZOBEX&keywords=furniture&qid=1654931783&rnid=1063306&s=home-garden&sprefix=furnitu%2Caps%2C297&sr=1-623,https://m.media-amazon.com/images/I/61YfLPzMbtL._AC_UL320_.jpg,4.5 out of 5 stars,545,$82.99
"Sauder International Lux Bar Cart, Satin Gold Finish",https://www.amazon.com/Sauder-417828-International-Glass-Finish/dp/B00WNCNQ86/ref=sr_1_624?crid=2THUN1PRZOBEX&keywords=furniture&qid=1654931783&rnid=1063306&s=home-garden&sprefix=furnitu%2Caps%2C297&sr=1-624,https://m.media-amazon.com/images/I/818C8DaeFjL._AC_UL320_.jpg,4.8 out of 5 stars,399,$135.00
"Hillsdale Aubrie Swivel Backless Bar Height Stool, Barstool, Off White",https://www.amazon.com/Hillsdale-Furniture-4556-832-Aubrie-Backless/dp/B075YP2RSC/ref=sr_1_625?crid=2THUN1PRZOBEX&keywords=furniture&qid=1654931783&rnid=1063306&s=home-garden&sprefix=furnitu%2Caps%2C297&sr=1-625,https://m.media-amazon.com/images/I/31kcxjyJcIL._AC_UL320_.jpg,4.5 out of 5 stars,251,$89.30
"Hillsdale Cromwell Metal Counter Height Stool, Taupe",https://www.amazon.com/Hillsdale-Cromwell-Counter-Height-Velvet/dp/B087T3Q5HJ/ref=sr_1_626?crid=2THUN1PRZOBEX&keywords=furniture&qid=1654931783&rnid=1063306&s=home-garden&sprefix=furnitu%2Caps%2C297&sr=1-626,https://m.media-amazon.com/images/I/41lFBnxGnPL._AC_UL320_.jpg,3.4 out of 5 stars,18,$143.99
"Powell Big and Tall Metal Crossed Legs Counter Stool, 9.49"" x 21.26"" x 43.31"", Seat Height: 24"", Bronze & Mocha",https://www.amazon.com/Powell-Metal-Crossed-Counter-Stool/dp/B00CMAIY68/ref=sr_1_627?crid=2THUN1PRZOBEX&keywords=furniture&qid=1654931783&rnid=1063306&s=home-garden&sprefix=furnitu%2Caps%2C297&sr=1-627,https://m.media-amazon.com/images/I/71wZ7Ft2C+L._AC_UL320_.jpg,4.4 out of 5 stars,76,$124.99
"FUBIRUO Vintage Industrial Bar Stools,Kitchen Counter Bar Stool Height Adjustable 23.6""-29.5"" Swivel Bar Stool, Solid Wood Water Pipe Fire Cafe Pub Bar Stool,Set of 2, Black",https://www.amazon.com/FUBIRUO-Vintage-Industrial-Kitchen-Adjustable/dp/B095WR3JMR/ref=sr_1_628?crid=2THUN1PRZOBEX&keywords=furniture&qid=1654931783&rnid=1063306&s=home-garden&sprefix=furnitu%2Caps%2C297&sr=1-628,https://m.media-amazon.com/images/I/61pQa0US3AL._AC_UL320_.jpg,4.7 out of 5 stars,17,$156.99
"Angel Line Cambridge bar stools, 24"" Set of 2, White with Gray Cushion",https://www.amazon.com/Angel-Line-43418-21-Cambridge-Cushion/dp/B01IJCO3JO/ref=sr_1_629?crid=2THUN1PRZOBEX&keywords=furniture&qid=1654931783&rnid=1063306&s=home-garden&sprefix=furnitu%2Caps%2C297&sr=1-629,https://m.media-amazon.com/images/I/61RGuYqVOBS._AC_UL320_.jpg,4.8 out of 5 stars,"11,928",$118.40
"Mochi Furniture Swartz Swivel Stool, 24-Inch, Cappuccino",https://www.amazon.com/Mochi-Furniture-Swartz-24-Inch-Cappuccino/dp/B00FWG7QQ8/ref=sr_1_630?crid=2THUN1PRZOBEX&keywords=furniture&qid=1654931783&rnid=1063306&s=home-garden&sprefix=furnitu%2Caps%2C297&sr=1-630,https://m.media-amazon.com/images/I/81vjthK72UL._AC_UL320_.jpg,,,$183.16
"CHITA Counter Height Barstool, Upholstered Fabric Bar Stool, 26"" H Seat Height, Lemon Yellow",https://www.amazon.com/gp/slredirect/picassoRedirect.html/ref=pa_sp_btf_garden_sr_pg26_1?ie=UTF8&adId=A012907318FM2WF6IIIGG&url=%2FCHITA-Counter-Height-Upholstered-Fabric%2Fdp%2FB083DCDP2J%2Fref%3Dsr_1_631_sspa%3Fcrid%3D2THUN1PRZOBEX%26keywords%3Dfurniture%26qid%3D1654931783%26rnid%3D1063306%26s%3Dhome-garden%26sprefix%3Dfurnitu%252Caps%252C297%26sr%3D1-631-spons%26psc%3D1&qualifier=1654931783&id=1455459504582092&widgetName=sp_btf,https://m.media-amazon.com/images/I/51C+Wv2ZUAL._AC_UL320_.jpg,4.6 out of 5 stars,434,$159.00
"Hillsdale Furniture Hillsdale Savana Swivel Counter Stool, Blue",https://www.amazon.com/gp/slredirect/picassoRedirect.html/ref=pa_sp_btf_garden_sr_pg26_1?ie=UTF8&adId=A1009265TM7HAJEEP30B&url=%2FHillsdale-Furniture-4617-826-Savana-Counter%2Fdp%2FB075XMKMQ4%2Fref%3Dsr_1_632_sspa%3Fcrid%3D2THUN1PRZOBEX%26keywords%3Dfurniture%26qid%3D1654931783%26rnid%3D1063306%26s%3Dhome-garden%26sprefix%3Dfurnitu%252Caps%252C297%26sr%3D1-632-spons%26psc%3D1&qualifier=1654931783&id=1455459504582092&widgetName=sp_btf,https://m.media-amazon.com/images/I/41y5k3OSJrL._AC_UL320_.jpg,4.6 out of 5 stars,360,$127.09
"MAISON ARTS Counter Height Swivel Bar Stools Set of 2 Adjustable Barstools with Back for Kitchen Counter Tall Bar Height Chairs Faux Leather High Stools for Kitchen Island,Support 300 LBS,Brown",https://www.amazon.com/gp/slredirect/picassoRedirect.html/ref=pa_sp_btf_garden_sr_pg26_1?ie=UTF8&adId=A0692868IO58ZHM1S1RT&url=%2FMAISON-ARTS-Adjustable-Barstools-Capacity%2Fdp%2FB08ZXV9NB9%2Fref%3Dsr_1_633_sspa%3Fcrid%3D2THUN1PRZOBEX%26keywords%3Dfurniture%26qid%3D1654931783%26rnid%3D1063306%26s%3Dhome-garden%26sprefix%3Dfurnitu%252Caps%252C297%26sr%3D1-633-spons%26psc%3D1&qualifier=1654931783&id=1455459504582092&widgetName=sp_btf,https://m.media-amazon.com/images/I/71SsW+PYpRL._AC_UL320_.jpg,4.3 out of 5 stars,459,$209.99
