Title,Url,Image,Avg_ratings,Num_ratings,Price
"HERA'S PALACE PU Leather Adjustable Swivel Bar Stools, Counter Height Swivel Stool with Armrest and Backrest, Modern & Stylish, Bar Stools for Bar, Cafe, Kitchen",https://www.amazon.com/gp/slredirect/picassoRedirect.html/ref=pa_sp_btf_garden_sr_pg55_1?ie=UTF8&adId=A09394201G4FSF256K74L&url=%2FHERAS-PALACE-Leather-Adjustable-Backrest%2Fdp%2FB0B2QY3P3V%2Fref%3Dsr_1_1317_sspa%3Fcrid%3D2THUN1PRZOBEX%26keywords%3Dfurniture%26qid%3D1654932079%26rnid%3D1063306%26s%3Dhome-garden%26sprefix%3Dfurnitu%252Caps%252C297%26sr%3D1-1317-spons%26psc%3D1&qualifier=1654932079&id=3670903303065504&widgetName=sp_btf,https://m.media-amazon.com/images/I/61XrEOjToLL._AC_UL320_.jpg,,,$149.95
"Park Hill Collection EFS80573 Metal Milking Stool, 12-inch Diameter",https://www.amazon.com/gp/slredirect/picassoRedirect.html/ref=pa_sp_btf_garden_sr_pg55_1?ie=UTF8&adId=A0363308224ADGDJMV67Q&url=%2FPark-Hill-Collection-EFS80573-Diameter%2Fdp%2FB08SM7WXJD%2Fref%3Dsr_1_1318_sspa%3Fcrid%3D2THUN1PRZOBEX%26keywords%3Dfurniture%26qid%3D1654932079%26rnid%3D1063306%26s%3Dhome-garden%26sprefix%3Dfurnitu%252Caps%252C297%26sr%3D1-1318-spons%26psc%3D1&qualifier=1654932079&id=3670903303065504&widgetName=sp_btf,https://m.media-amazon.com/images/I/61AUv0a4G2L._AC_UL320_.jpg,,,$64.99
Fatboy USA Original Slim Bean Bag Chair,https://www.amazon.com/gp/slredirect/picassoRedirect.html/ref=pa_sp_btf_garden_sr_pg55_1?ie=UTF8&adId=A09317343IRP5VXIGCGRK&url=%2FFatboy-USA-Original-Slim-Chair%2Fdp%2FB07T86LGT3%2Fref%3Dsr_1_1319_sspa%3Fcrid%3D2THUN1PRZOBEX%26keywords%3Dfurniture%26qid%3D1654932079%26rnid%3D1063306%26s%3Dhome-garden%26sprefix%3Dfurnitu%252Caps%252C297%26sr%3D1-1319-spons%26psc%3D1&qualifier=1654932079&id=3670903303065504&widgetName=sp_btf,https://m.media-amazon.com/images/I/71zraBnCuWL._AC_UL320_.jpg,3.7 out of 5 stars,41,$199.00
"Brigii Mini Vacuum, Air Duster and Hand Pump 3 in 1, Small Cordless Handheld Vacuum, USB Rechargeable, Easy to Clean Desktop, Keyboard, Drawer, Car Interior and Other Crevices, Small Spaces -Y120 Pro",https://www.amazon.com/gp/slredirect/picassoRedirect.html/ref=pa_sp_atf_next_garden_sr_pg78_1?ie=UTF8&adId=A025625221VJ9R58ZCF6F&url=%2FBrigii-Cordless-Handheld-Rechargeable-Keyboard%2Fdp%2FB087JRV75R%2Fref%3Dsr_1_1849_sspa%3Fcrid%3D2THUN1PRZOBEX%26keywords%3Dfurniture%26qid%3D1654932158%26rnid%3D1063306%26s%3Dhome-garden%26sprefix%3Dfurnitu%252Caps%252C297%26sr%3D1-1849-spons%26psc%3D1&qualifier=1654932158&id=2868014172982251&widgetName=sp_atf_next,https://m.media-amazon.com/images/I/61SfkiF4pML._AC_UL320_.jpg,4.2 out of 5 stars,"3,880",$46.99
"Mounting Brackets Fit for Samsung Sound Bar Model HW-MS550 HW-MS560 HW-MS57C HW-MS750 HW-MS751 HW-MS650 HW-MS6500 HW-MS6510 HW-MS6511 HW-MS660 HW-MS661,Black",https://www.amazon.com/gp/slredirect/picassoRedirect.html/ref=pa_sp_atf_next_garden_sr_pg78_1?ie=UTF8&adId=A04520047XXA06A576Q3&url=%2FMounting-Brackets-HW-MS6500-HW-MS6510-HW-MS6511%2Fdp%2FB09WR7W5G1%2Fref%3Dsr_1_1850_sspa%3Fcrid%3D2THUN1PRZOBEX%26keywords%3Dfurniture%26qid%3D1654932158%26rnid%3D1063306%26s%3Dhome-garden%26sprefix%3Dfurnitu%252Caps%252C297%26sr%3D1-1850-spons%26psc%3D1&qualifier=1654932158&id=2868014172982251&widgetName=sp_atf_next,https://m.media-amazon.com/images/I/51o-4C0P6VL._AC_UL320_.jpg,5.0 out of 5 stars,1,$20.99
"Hide & Drink, Thick Leather Coasters, Set of 4 / Drinking Figures / Stain / Furniture Protection / Home Decor / Bar / Office / Kitchen, Handmade :: Bourbon Brown",https://www.amazon.com/gp/slredirect/picassoRedirect.html/ref=pa_sp_atf_next_garden_sr_pg78_1?ie=UTF8&adId=A0572257OFE9ONX11TDM&url=%2FHide-Drink-Coasters-Furniture-Protection%2Fdp%2FB07NDH782B%2Fref%3Dsr_1_1851_sspa%3Fcrid%3D2THUN1PRZOBEX%26keywords%3Dfurniture%26qid%3D1654932158%26rnid%3D1063306%26s%3Dhome-garden%26sprefix%3Dfurnitu%252Caps%252C297%26sr%3D1-1851-spons%26psc%3D1&qualifier=1654932158&id=2868014172982251&widgetName=sp_atf_next,https://m.media-amazon.com/images/I/51clJ-uzWbL._AC_UL320_.jpg,5.0 out of 5 stars,1,$18.98
OTTERLEAd Vedio Gaming Floor Chair 14 Gear Adjustment Back Support Folding Sofa Bed Adjustment Ergonomic Large Lounger Chair Easy for Storage Comfortable Padded Gaming Chair for Adults(Gray),https://www.amazon.com/OTTERLEAd-Adjustment-Support-Folding-Ergonomic/dp/B09LMCRR5D/ref=sr_1_1852?crid=2THUN1PRZOBEX&keywords=furniture&qid=1654932158&rnid=1063306&s=home-garden&sprefix=furnitu%2Caps%2C297&sr=1-1852,https://m.media-amazon.com/images/I/61onhgIkoFL._AC_UL320_.jpg,5.0 out of 5 stars,1,$139.99
"4th of July Decorations - Patriotic Decor Party Supplies for July Fourth Memorial Day, 7 Patriotic Wooden Signs & Gnomes Plush, Farmhouse Tiered Tray Decor Items for Home Table Independence Labor",https://www.amazon.com/4th-July-Decorations-Patriotic-Independence/dp/B09XX4P8FZ/ref=sr_1_1853?crid=2THUN1PRZOBEX&keywords=furniture&qid=1654932158&rnid=1063306&s=home-garden&sprefix=furnitu%2Caps%2C297&sr=1-1853,https://m.media-amazon.com/images/I/71KOA6hnCCL._AC_UL320_.jpg,,,$20.99
"TVON Universal Tabletop TV Stand Base with Swivel Mount for 50-86 Inch Flat Screen TVs, 5-Level Height Adjustable, Tempered Glass Base, Holds up to 132 lbs, Black",https://www.amazon.com/TVON-Universal-Tabletop-Adjustable-Tempered/dp/B0894WC86P/ref=sr_1_1854?crid=2THUN1PRZOBEX&keywords=furniture&qid=1654932158&rnid=1063306&s=home-garden&sprefix=furnitu%2Caps%2C297&sr=1-1854,https://m.media-amazon.com/images/I/711k2ddANzL._AC_UL320_.jpg,4.6 out of 5 stars,289,$86.99
"Winsome Mona Stool, 24"", Antique Walnut",https://www.amazon.com/Winsome-94064-Stool-Antique-Walnut/dp/B005337XJU/ref=sr_1_1855?crid=2THUN1PRZOBEX&keywords=furniture&qid=1654932158&rnid=1063306&s=home-garden&sprefix=furnitu%2Caps%2C297&sr=1-1855,https://m.media-amazon.com/images/I/61eGlxNZW7L._AC_UL320_.jpg,4.3 out of 5 stars,"2,089",$45.96
"MANCHAP 4 PCS 6 Inch Bar Stool Swivel Plate Replacement, Ball Bearing Seat Swivel Base Mount Plate for Bar Stool, Swivel Chair or Recliner, Black",https://www.amazon.com/MANCHAP-Swivel-Replacement-Bearing-Recliner/dp/B09QHQGWX8/ref=sr_1_1856?crid=2THUN1PRZOBEX&keywords=furniture&qid=1654932158&rnid=1063306&s=home-garden&sprefix=furnitu%2Caps%2C297&sr=1-1856,https://m.media-amazon.com/images/I/81qP9QTuR5L._AC_UL320_.jpg,,,$29.99
Amazon Basics Racing/Gaming Style Office Chair - White,https://www.amazon.com/AmazonBasics-Racing-Gaming-Style-Office/dp/B0888M8SYT/ref=sr_1_1857?crid=2THUN1PRZOBEX&keywords=furniture&qid=1654932158&rnid=1063306&s=home-garden&sprefix=furnitu%2Caps%2C297&sr=1-1857,https://m.media-amazon.com/images/I/81cnznhP4YL._AC_UL320_.jpg,4.4 out of 5 stars,478,$92.24
Floor Folding Chair Light Portable Lazy Boy Recliner W/Back Support Adjustable Couch Recliner Folding Lazy Chair Stylish Padded Floor Seat Recliner for Reading Watching Video Gaming Meditation (Black,https://www.amazon.com/Portable-Recliner-Adjustable-Watching-Meditation/dp/B09PV51CC8/ref=sr_1_1858?crid=2THUN1PRZOBEX&keywords=furniture&qid=1654932158&rnid=1063306&s=home-garden&sprefix=furnitu%2Caps%2C297&sr=1-1858,https://m.media-amazon.com/images/I/716UGMbow7L._AC_UL320_.jpg,,,$164.99
"Benjara Metal Framed Stool with Fabric Upholstered Tufted Seat, Gray and Black",https://www.amazon.com/Benjara-Framed-Fabric-Upholstered-Tufted/dp/B07S42RTD4/ref=sr_1_1859?crid=2THUN1PRZOBEX&keywords=furniture&qid=1654932158&rnid=1063306&s=home-garden&sprefix=furnitu%2Caps%2C297&sr=1-1859,https://m.media-amazon.com/images/I/81PNBJ403fL._AC_UL320_.jpg,,,$87.67
"Stakmore Urn Back Folding Chair Finish, Set of 2, Cherry",https://www.amazon.com/Stakmore-Folding-Chair-Finish-Cherry/dp/B00PIGVOG0/ref=sr_1_1860?crid=2THUN1PRZOBEX&keywords=furniture&qid=1654932158&rnid=1063306&s=home-garden&sprefix=furnitu%2Caps%2C297&sr=1-1860,https://m.media-amazon.com/images/I/71ZnrAeOcyL._AC_UL320_.jpg,4.7 out of 5 stars,98,$129.99
"Kouboo Rattan Foot Stool, Natural",https://www.amazon.com/Kouboo-1110020-Loop-Stool-Natural/dp/B071GMJ7LL/ref=sr_1_1861?crid=2THUN1PRZOBEX&keywords=furniture&qid=1654932158&rnid=1063306&s=home-garden&sprefix=furnitu%2Caps%2C297&sr=1-1861,https://m.media-amazon.com/images/I/51t1MqRoVVL._AC_UL320_.jpg,4.6 out of 5 stars,24,$213.99
"Crestlive Products Easy Lounge, Adjustable Padded Floor Chair with Back Support, Comfortable Folding Chair with Backrest for Home and Office, Floor Pillow for Meditation or as Gaming Chair (Gray)",https://www.amazon.com/Crestlive-Products-Adjustable-Comfortable-Meditation/dp/B07QWKSJ56/ref=sr_1_1862?crid=2THUN1PRZOBEX&keywords=furniture&qid=1654932158&rnid=1063306&s=home-garden&sprefix=furnitu%2Caps%2C297&sr=1-1862,https://m.media-amazon.com/images/I/61Sczt2uP-L._AC_UL320_.jpg,4.3 out of 5 stars,102,$121.99
"Soundbar Wall Mount Bracket for Samsung HW-M360 HW-K550 HW-K550 HW-M550 HW-K650 HW-K430 HW-K335 HW-K651 HW-K450 Mount, 2 Pieces Black Wall Bracket Holder + Screws + Metal Holder Screws",https://www.amazon.com/Soundbar-Bracket-Samsung-HW-M360-HW-K550/dp/B07RXYC86Z/ref=sr_1_1863?crid=2THUN1PRZOBEX&keywords=furniture&qid=1654932158&rnid=1063306&s=home-garden&sprefix=furnitu%2Caps%2C297&sr=1-1863,https://m.media-amazon.com/images/I/51c43OsYrvL._AC_UL320_.jpg,4.4 out of 5 stars,70,$24.99
"6 Packs Metal TV Safety Straps Furniture Security Straps Anchor TV Anti Tip Straps for Baby Proofing Child Protection Flat Screen TV, Cabinet, Dresser, Drawer",https://www.amazon.com/gp/slredirect/picassoRedirect.html/ref=pa_sp_mtf_garden_sr_pg78_1?ie=UTF8&adId=A08933372CHM37HQCXIX7&url=%2FFurniture-Security-Proofing-Protection-Cabinet%2Fdp%2FB09VPJ5KCJ%2Fref%3Dsr_1_1864_sspa%3Fcrid%3D2THUN1PRZOBEX%26keywords%3Dfurniture%26qid%3D1654932158%26rnid%3D1063306%26s%3Dhome-garden%26sprefix%3Dfurnitu%252Caps%252C297%26sr%3D1-1864-spons%26psc%3D1&qualifier=1654932158&id=2868014172982251&widgetName=sp_mtf,https://m.media-amazon.com/images/I/81k+8jhZFyL._AC_UL320_.jpg,,,$18.99
"Jinsi Nan 1-Piece Set with Back armrest, 360 Degree Rotating bar Stool, bar Chair, bar Stool, Kitchen Stool, Front Desk Chair, Courtyard Stool, bar Furniture, bar Chair (Front Black, Back White)",https://www.amazon.com/gp/slredirect/picassoRedirect.html/ref=pa_sp_mtf_garden_sr_pg78_1?ie=UTF8&adId=A02752671XXE74WL8OJ2X&url=%2FJinsi-Nan-Rotating-Courtyard-Furniture%2Fdp%2FB09R1GYBXD%2Fref%3Dsr_1_1865_sspa%3Fcrid%3D2THUN1PRZOBEX%26keywords%3Dfurniture%26qid%3D1654932158%26rnid%3D1063306%26s%3Dhome-garden%26sprefix%3Dfurnitu%252Caps%252C297%26sr%3D1-1865-spons%26psc%3D1&qualifier=1654932158&id=2868014172982251&widgetName=sp_mtf,https://m.media-amazon.com/images/I/51zAJey1kiL._AC_UL320_.jpg,,,$170.00
"Topower Farmhouse Kitchen Stool, Industrial Counter Stool, Kitchen Deco Round Seat Standard Height Adjustable Bar Stools Indoor House Design (Blue 2pcs, PU Leather Top)",https://www.amazon.com/gp/slredirect/picassoRedirect.html/ref=pa_sp_mtf_garden_sr_pg78_1?ie=UTF8&adId=A06953832SX2DA9L5XXHS&url=%2FTopower-Farmhouse-Industrial-Standard-Adjustable%2Fdp%2FB08T6L9LMJ%2Fref%3Dsr_1_1866_sspa%3Fcrid%3D2THUN1PRZOBEX%26keywords%3Dfurniture%26qid%3D1654932158%26rnid%3D1063306%26s%3Dhome-garden%26sprefix%3Dfurnitu%252Caps%252C297%26sr%3D1-1866-spons%26psc%3D1&qualifier=1654932158&id=2868014172982251&widgetName=sp_mtf,https://m.media-amazon.com/images/I/61FuY1zMadL._AC_UL320_.jpg,4.4 out of 5 stars,442,$155.00
"Deco 79 Metal Stool, 15-Inch by 18-Inch",https://www.amazon.com/Deco-79-Metal-15-Inch-18-Inch/dp/B00TQUKUW8/ref=sr_1_1867?crid=2THUN1PRZOBEX&keywords=furniture&qid=1654932158&rnid=1063306&s=home-garden&sprefix=furnitu%2Caps%2C297&sr=1-1867,https://m.media-amazon.com/images/I/71t6c4EO+2L._AC_UL320_.jpg,4.0 out of 5 stars,2,$49.72
"iMounTEK Tilting TV Wall Mount Bracket for 37"" to 70"" LED/LCD/OLED/Plasma Flat Screen TV. Full Motion Swivel Articulating Dual Arms, 99 LBS Hold- Sony/LG/Samsung/Panasonic/Vizio/Toshiba",https://www.amazon.com/iMounTEK-Tilting-Bracket-Articulating-Panasonic/dp/B0749QL5FD/ref=sr_1_1868?crid=2THUN1PRZOBEX&keywords=furniture&qid=1654932158&rnid=1063306&s=home-garden&sprefix=furnitu%2Caps%2C297&sr=1-1868,https://m.media-amazon.com/images/I/71enlg8YrJL._AC_UL320_.jpg,3.5 out of 5 stars,14,$66.99
3 Pack Carry Strap for Beach Chair Folding Chair Adjustable Beach Chair Carry Strap Replacement Universal Folding Chair Carry Strap for Beaches Camping Backpacking Picnics,https://www.amazon.com/Folding-Adjustable-Replacement-Universal-Backpacking/dp/B09TVXPBRT/ref=sr_1_1869?crid=2THUN1PRZOBEX&keywords=furniture&qid=1654932158&rnid=1063306&s=home-garden&sprefix=furnitu%2Caps%2C297&sr=1-1869,https://m.media-amazon.com/images/I/61jFY+KZz6L._AC_UL320_.jpg,4.4 out of 5 stars,24,$21.99
Spartan Mounts Wall Mounting Solution for Samsung TV Remote Control BN59-01199F,https://www.amazon.com/Spartan-Mounts-Mounting-Solution-BN59-01199F/dp/B09V8C386F/ref=sr_1_1870?crid=2THUN1PRZOBEX&keywords=furniture&qid=1654932158&rnid=1063306&s=home-garden&sprefix=furnitu%2Caps%2C297&sr=1-1870,https://m.media-amazon.com/images/I/61JaSPYIPZL._AC_UL320_.jpg,,,$10.99
"KROTUCOTY TV Top Shelf 12-Inch Wide Computer Screen Top Bracket Monitor Top Shelfs Mount, Adjustable Screen Shelf Stuff Organizer for Wi-Fi Router, Cable Box, Streaming Devices, Remote Controls",https://www.amazon.com/KROTUCOTY-Computer-Adjustable-Organizer-Streaming/dp/B09SW7JPG9/ref=sr_1_1871?crid=2THUN1PRZOBEX&keywords=furniture&qid=1654932158&rnid=1063306&s=home-garden&sprefix=furnitu%2Caps%2C297&sr=1-1871,https://m.media-amazon.com/images/I/41uQIE8yAKL._AC_UL320_.jpg,,,$19.99
Atdec Pole Mount for Monitor,https://www.amazon.com/Atdec-Pole-Mount-for-Monitor/dp/B07PHV27VB/ref=sr_1_1872?crid=2THUN1PRZOBEX&keywords=furniture&qid=1654932158&rnid=1063306&s=home-garden&sprefix=furnitu%2Caps%2C297&sr=1-1872,https://m.media-amazon.com/images/I/31l4erjMg+L._AC_UL320_.jpg,,,$8.58
United States Army Padded Swivel Bar Stool,https://www.amazon.com/United-States-Padded-Swivel-Stool/dp/B006DWKRDO/ref=sr_1_1873?crid=2THUN1PRZOBEX&keywords=furniture&qid=1654932158&rnid=1063306&s=home-garden&sprefix=furnitu%2Caps%2C297&sr=1-1873,https://m.media-amazon.com/images/I/71uskNlVqlL._AC_UL320_.jpg,4.0 out of 5 stars,3,$99.95
"Deco 79 Farmhouse Metal Rectangle Storage Cart, 32"" x 12"" x 35"", White",https://www.amazon.com/Deco-79-Storage-Cart-White/dp/B097QGC3N8/ref=sr_1_1874?crid=2THUN1PRZOBEX&keywords=furniture&qid=1654932158&rnid=1063306&s=home-garden&sprefix=furnitu%2Caps%2C297&sr=1-1874,https://m.media-amazon.com/images/I/714MhpOx+MS._AC_UL320_.jpg,,,$168.22
"JEUIHAU 2 Pack 6.25 Inches Bar Stool Swivel Plate, Black Bar Stool Swivel Plate, Seat Swivel Base Mount Plate for Bar Stool, Chair, 300 Lbs Load Capacity",https://www.amazon.com/JEUIHAU-Inches-Stool-Swivel-Capacity/dp/B09KS3PM8F/ref=sr_1_1875?crid=2THUN1PRZOBEX&keywords=furniture&qid=1654932158&rnid=1063306&s=home-garden&sprefix=furnitu%2Caps%2C297&sr=1-1875,https://m.media-amazon.com/images/I/71pC0IxW3sL._AC_UL320_.jpg,3.0 out of 5 stars,1,$19.49
SUPERJARE Steel Base for Bar Stool - P0052,https://www.amazon.com/SUPERJARE-Steel-Base-Bar-Stool/dp/B07N7K4HWX/ref=sr_1_1876?crid=2THUN1PRZOBEX&keywords=furniture&qid=1654932158&rnid=1063306&s=home-garden&sprefix=furnitu%2Caps%2C297&sr=1-1876,https://m.media-amazon.com/images/I/31vldXj0YbL._AC_UL320_.jpg,,,$39.99
"Bar Carts/Serving Carts/Kitchen Carts/Wine Rack Carts on Wheels,Rolling Carts (4-Layer)",https://www.amazon.com/Serving-Kitchen-Wheels-Rolling-4-Layer/dp/B09L4VMN7L/ref=sr_1_1877?crid=2THUN1PRZOBEX&keywords=furniture&qid=1654932158&rnid=1063306&s=home-garden&sprefix=furnitu%2Caps%2C297&sr=1-1877,https://m.media-amazon.com/images/I/81bzG8FE+cL._AC_UL320_.jpg,4.2 out of 5 stars,7,$179.99
"DS-1280ZJ-DM25 Bracket, Wall Mount Bracket, Hide Cable Junction Box, Fisheye Camera Bracket Compatible with Dome Camera DS-2CD6362F-I, DS-2CD6332FWD-I, DS-2CD6362F-IS, S-2CD63C2F-IVS",https://www.amazon.com/DS-1280ZJ-DM25-DS-2CD6362F-I-DS-2CD6332FWD-I-DS-2CD6362F-S-2CD63C2F-IVS/dp/B01D0X7K2E/ref=sr_1_1878?crid=2THUN1PRZOBEX&keywords=furniture&qid=1654932158&rnid=1063306&s=home-garden&sprefix=furnitu%2Caps%2C297&sr=1-1878,https://m.media-amazon.com/images/I/61zcUlcKNeL._AC_UL320_.jpg,4.6 out of 5 stars,2,$26.99
"Carlisle XDL3000H03 Cateraide Polyethylene Dolly with Handle, 28-3/4"" Length x 22-3/8"" Width x 5"" Depth, Black",https://www.amazon.com/gp/slredirect/picassoRedirect.html/ref=pa_sp_btf_garden_sr_pg78_1?ie=UTF8&adId=A0443096DDN0SQIWFI7Z&url=%2FCarlisle-Cateraide-XT3000R-Top-Loading-Carrier%2Fdp%2FB002MVF3AW%2Fref%3Dsr_1_1879_sspa%3Fcrid%3D2THUN1PRZOBEX%26keywords%3Dfurniture%26qid%3D1654932158%26rnid%3D1063306%26s%3Dhome-garden%26sprefix%3Dfurnitu%252Caps%252C297%26sr%3D1-1879-spons%26psc%3D1&qualifier=1654932158&id=2868014172982251&widgetName=sp_btf,https://m.media-amazon.com/images/I/71V7jUOfBmS._AC_UL320_.jpg,4.4 out of 5 stars,2,$262.49
Topower Industrial Retro Vintage Farm Wooden Tractor Stool Kitchen Swivel Height Adjustable bar Stool (Antique White),https://www.amazon.com/gp/slredirect/picassoRedirect.html/ref=pa_sp_btf_garden_sr_pg78_1?ie=UTF8&adId=A09096213VBB4NU4HL0KI&url=%2FTopower-Industrial-Vintage-Tractor-Adjustable%2Fdp%2FB07DCPYFT8%2Fref%3Dsr_1_1880_sspa%3Fcrid%3D2THUN1PRZOBEX%26keywords%3Dfurniture%26qid%3D1654932158%26rnid%3D1063306%26s%3Dhome-garden%26sprefix%3Dfurnitu%252Caps%252C297%26sr%3D1-1880-spons%26psc%3D1&qualifier=1654932158&id=2868014172982251&widgetName=sp_btf,https://m.media-amazon.com/images/I/61tww-LJJhL._AC_UL320_.jpg,4.6 out of 5 stars,485,$101.00
"HERA'S PALACE Barstools Bar Height Stools with Footrest 30"" Bar Stool Counter Height Modern, Leather Bar Chairs Indoor for Kitchen, Living Room, Dining Bar, Brown",https://www.amazon.com/gp/slredirect/picassoRedirect.html/ref=pa_sp_btf_garden_sr_pg78_1?ie=UTF8&adId=A09985001IOB18UKSNGQO&url=%2FHERAS-PALACE-Barstools-Footrest-Counter%2Fdp%2FB0B1F14GS9%2Fref%3Dsr_1_1881_sspa%3Fcrid%3D2THUN1PRZOBEX%26keywords%3Dfurniture%26qid%3D1654932158%26rnid%3D1063306%26s%3Dhome-garden%26sprefix%3Dfurnitu%252Caps%252C297%26sr%3D1-1881-spons%26psc%3D1&qualifier=1654932158&id=2868014172982251&widgetName=sp_btf,https://m.media-amazon.com/images/I/71zFnOC4GhL._AC_UL320_.jpg,,,$89.95
"Kate and Laurel Mahdavi Boho-Chic Hammered Metal Tray Coffee Table, Brushed Silver",https://www.amazon.com/gp/slredirect/picassoRedirect.html/ref=pa_sp_atf_next_garden_sr_pg79_1?ie=UTF8&adId=A05043511D0A6JWCWZ8PG&url=%2FKate-Laurel-Mahdavi-Boho-Chic-Hammered%2Fdp%2FB07S97VD8N%2Fref%3Dsr_1_1873_sspa%3Fcrid%3D2THUN1PRZOBEX%26keywords%3Dfurniture%26qid%3D1654932205%26rnid%3D1063306%26s%3Dhome-garden%26sprefix%3Dfurnitu%252Caps%252C297%26sr%3D1-1873-spons%26psc%3D1&qualifier=1654932205&id=677136655158705&widgetName=sp_atf_next,https://m.media-amazon.com/images/I/81FSnycXCmL._AC_UL320_.jpg,4.6 out of 5 stars,233,$132.59
"LALAPORT 30"" Cocktail Spandex Stretch Cocktail highboy Table Covers use for 30"" x 42"" Cocktail Table, and Perfect for Wedding, Parties, Celebrations and Any Special Event (30 in x 42 in, Black)",https://www.amazon.com/gp/slredirect/picassoRedirect.html/ref=pa_sp_atf_next_garden_sr_pg79_1?ie=UTF8&adId=A02159872BQ4LN69PR1TX&url=%2FLALAPORT-Cocktail-Spandex-Stretch-Celebrations%2Fdp%2FB09XMBV6SH%2Fref%3Dsr_1_1874_sspa%3Fcrid%3D2THUN1PRZOBEX%26keywords%3Dfurniture%26qid%3D1654932205%26rnid%3D1063306%26s%3Dhome-garden%26sprefix%3Dfurnitu%252Caps%252C297%26sr%3D1-1874-spons%26psc%3D1&qualifier=1654932205&id=677136655158705&widgetName=sp_atf_next,https://m.media-amazon.com/images/I/41ybTJaNhJL._AC_UL320_.jpg,,,$11.99
"GREATUNE Vintage Coffee Table, Birch Wood Lift Top Coffee Table with Open Storage & Hidden Compartment, Central Table for Living Room, Adjustable Rising Table, Oak",https://www.amazon.com/gp/slredirect/picassoRedirect.html/ref=pa_sp_atf_next_garden_sr_pg79_1?ie=UTF8&adId=A01230813FCEKNZQ2ND90&url=%2FGREATUNE-Slide-Drawer-Storage-Compartment-Central%2Fdp%2FB0962B11KR%2Fref%3Dsr_1_1875_sspa%3Fcrid%3D2THUN1PRZOBEX%26keywords%3Dfurniture%26qid%3D1654932205%26rnid%3D1063306%26s%3Dhome-garden%26sprefix%3Dfurnitu%252Caps%252C297%26sr%3D1-1875-spons%26psc%3D1&qualifier=1654932205&id=677136655158705&widgetName=sp_atf_next,https://m.media-amazon.com/images/I/818m-XId7lL._AC_UL320_.jpg,3.6 out of 5 stars,11,$299.99
"Aiphone Corporation RY-3DL Selective Door Release Adaptor for JF, JM, or KB Series, ABS Plastic Construction",https://www.amazon.com/Aiphone-Corporation-RY-3DL-Selective-Construction/dp/B00JKAP6CS/ref=sr_1_1876?crid=2THUN1PRZOBEX&keywords=furniture&qid=1654932205&rnid=1063306&s=home-garden&sprefix=furnitu%2Caps%2C297&sr=1-1876,https://m.media-amazon.com/images/I/41-lijQxFNL._AC_UL320_.jpg,4.4 out of 5 stars,6,$85.00
"New Pacific Direct Elmo Bonded Leather Counter Stool, Brown",https://www.amazon.com/New-Pacific-Direct-198625B-01-Leather/dp/B01CVP9XIG/ref=sr_1_1877?crid=2THUN1PRZOBEX&keywords=furniture&qid=1654932205&rnid=1063306&s=home-garden&sprefix=furnitu%2Caps%2C297&sr=1-1877,https://m.media-amazon.com/images/I/81PSj2HGfPL._AC_UL320_.jpg,4.6 out of 5 stars,91,$141.53
"Homelegance Swivel Counter Height Chair, Brown",https://www.amazon.com/Homelegance-5447-24S-Swivel-Counter-Height/dp/B00CI4VV6S/ref=sr_1_1878?crid=2THUN1PRZOBEX&keywords=furniture&qid=1654932205&rnid=1063306&s=home-garden&sprefix=furnitu%2Caps%2C297&sr=1-1878,https://m.media-amazon.com/images/I/81zsnx-8NLL._AC_UL320_.jpg,4.2 out of 5 stars,56,$267.96
"MyGift Solid Acacia Wood TV Remote Control Holder for Table with 3 Compartments, Media Storage Caddy",https://www.amazon.com/MyGift-Compartment-Acacia-Control-Storage/dp/B09HSZ1BG8/ref=sr_1_1879?crid=2THUN1PRZOBEX&keywords=furniture&qid=1654932205&rnid=1063306&s=home-garden&sprefix=furnitu%2Caps%2C297&sr=1-1879,https://m.media-amazon.com/images/I/71TucGvgGWL._AC_UL320_.jpg,,,$24.99
"Classic Sofa Chairs Lazy Lounger Bean Bag Cover for Home Garden Lounge Living Room (Brown, 85105cm)",https://www.amazon.com/Classic-Chairs-Lounger-Garden-85105cm/dp/B08GLN94YR/ref=sr_1_1880?crid=2THUN1PRZOBEX&keywords=furniture&qid=1654932205&rnid=1063306&s=home-garden&sprefix=furnitu%2Caps%2C297&sr=1-1880,https://m.media-amazon.com/images/I/61rE9xof2oL._AC_UL320_.jpg,3.0 out of 5 stars,1,$29.99
"Tilting Wall Mount TV Bracket - Heavy Duty Universal Flat Screen TV Wall Mount - Mounts 26-52"" LED/LOLED & Plasma TV Flat Screens - Medium Tilt, VESA Mounting, 110 lbs Weight Capacity - PYLE PYWM24",https://www.amazon.com/Tilting-Wall-Mount-Bracket-Universal/dp/B087W8R75J/ref=sr_1_1881?crid=2THUN1PRZOBEX&keywords=furniture&qid=1654932205&rnid=1063306&s=home-garden&sprefix=furnitu%2Caps%2C297&sr=1-1881,https://m.media-amazon.com/images/I/81ge-9XEdbL._AC_UL320_.jpg,5.0 out of 5 stars,1,$63.99
Rock Solid VESA Studio Monitor Mount for Stands,https://www.amazon.com/Solid-Studio-Monitor-Mount-Stands/dp/B010BUDUBE/ref=sr_1_1882?crid=2THUN1PRZOBEX&keywords=furniture&qid=1654932205&rnid=1063306&s=home-garden&sprefix=furnitu%2Caps%2C297&sr=1-1882,https://m.media-amazon.com/images/I/51g4Na+UMbL._AC_UL320_.jpg,4.4 out of 5 stars,9,$249.95
Waffle House Vintage Padded Swivel Bar Stool with Back,https://www.amazon.com/Waffle-House-Vintage-Padded-Swivel/dp/B00P3VQQK4/ref=sr_1_1873?crid=2THUN1PRZOBEX&keywords=furniture&qid=1654932205&rnid=1063306&s=home-garden&sprefix=furnitu%2Caps%2C297&sr=1-1873,https://m.media-amazon.com/images/I/81-7ywRWm9L._AC_UL320_.jpg,,,$117.83
"AutoFull Gaming Chair Racing Style Ergonomic High Back Computer Chair with Height Adjustment, Headrest and Lumbar Support E-Sports Swivel Chair，Blue",https://www.amazon.com/AutoFull-Ergonomic-Computer-Adjustment-Chair%EF%BC%8CBlue/dp/B08BCPY4RS/ref=sr_1_1874?crid=2THUN1PRZOBEX&keywords=furniture&qid=1654932205&rnid=1063306&s=home-garden&sprefix=furnitu%2Caps%2C297&sr=1-1874,https://m.media-amazon.com/images/I/61YFPGc6TWL._AC_UL320_.jpg,4.4 out of 5 stars,"2,116",$229.99
"SIMPLIHOME Marana Mid Century Modern Bentwood Adjustable Height Gas Lift Bar Stool in Stone Grey Faux Leather, Curved, Swivel, Gas Lift Adjustable Height, Mid Century Modern Simple Assembly",https://www.amazon.com/SIMPLIHOME-Bedford-Universal-Entertainment-Storage/dp/B07JXX64TF/ref=sr_1_1875?crid=2THUN1PRZOBEX&keywords=furniture&qid=1654932205&rnid=1063306&s=home-garden&sprefix=furnitu%2Caps%2C297&sr=1-1875,https://m.media-amazon.com/images/I/710OsUZ77eL._AC_UL320_.jpg,4.3 out of 5 stars,76,$152.72
"MyGift Whitewashed Solid Wood Remote Control Holder, Organizing Caddy, Media Storage Box with Cursive REMOTES Print Design",https://www.amazon.com/MyGift-Whitewashed-Control-Organizing-Storage/dp/B09P4K8HZS/ref=sr_1_1876?crid=2THUN1PRZOBEX&keywords=furniture&qid=1654932205&rnid=1063306&s=home-garden&sprefix=furnitu%2Caps%2C297&sr=1-1876,https://m.media-amazon.com/images/I/71NdCkAcyyL._AC_UL320_.jpg,5.0 out of 5 stars,2,$25.99
"NewRidge Home Goods NewRidge Home Zoey Height Bar Stool, White",https://www.amazon.com/NewRidge-Home-Goods-Height-Stool/dp/B084ZR574X/ref=sr_1_1877?crid=2THUN1PRZOBEX&keywords=furniture&qid=1654932205&rnid=1063306&s=home-garden&sprefix=furnitu%2Caps%2C297&sr=1-1877,https://m.media-amazon.com/images/I/81Bt461CptL._AC_UL320_.jpg,3.8 out of 5 stars,8,$105.11
"Sauder 417830 Int Lux Coffee Table Round, Glass / Gold Finish",https://www.amazon.com/gp/slredirect/picassoRedirect.html/ref=pa_sp_mtf_garden_sr_pg79_1?ie=UTF8&adId=A0638136N7U8FYRNDPQY&url=%2FSauder-417830-Coffee-Table-Finish%2Fdp%2FB00WNDM3HU%2Fref%3Dsr_1_1878_sspa%3Fcrid%3D2THUN1PRZOBEX%26keywords%3Dfurniture%26qid%3D1654932205%26rnid%3D1063306%26s%3Dhome-garden%26sprefix%3Dfurnitu%252Caps%252C297%26sr%3D1-1878-spons%26psc%3D1&qualifier=1654932205&id=677136655158705&widgetName=sp_mtf,https://m.media-amazon.com/images/I/919hw0u5FQL._AC_UL320_.jpg,4.7 out of 5 stars,497,$119.19
